"Pathway","R2mean","R2median","R2sd","V1VE"
"'De Novo' Post-Translational Protein Folding (GO:0051084)",0.995133768197222,0.995208677151671,0.00146649465677711,0.997716746607381
"2-Oxoglutarate Metabolic Process (GO:0006103)",0.974971171625346,0.977342316204666,0.0100238819157053,0.988523709510846
"3'-UTR-mediated mRNA Destabilization (GO:0061158)",0.998778222726482,0.998788731132315,0.00051237047752766,0.999290953667103
"3'-UTR-mediated mRNA Stabilization (GO:0070935)",0.997889923082309,0.997929156162184,0.000659868403151231,0.998900098024875
"ATP Metabolic Process (GO:0046034)",0.996467197542119,0.996837838062277,0.00181415546889285,0.99791581347762
"Arp2/3 Complex-Mediated Actin Nucleation (GO:0034314)",0.997726332692788,0.99783063298994,0.00177808586514861,0.999208880417171
"B Cell Activation (GO:0042113)",0.996665520907486,0.996541398884426,0.000744623654077065,0.997835762785169
"B Cell Activation Involved In Immune Response (GO:0002312)",0.996732465920131,0.997714424633201,0.00254643629714717,0.997826778669621
"B Cell Differentiation (GO:0030183)",0.99695647426927,0.996800399743709,0.000835508174233968,0.998024980024184
"B Cell Mediated Immunity (GO:0019724)",0.996581980204495,0.996445563806536,0.00134880520930617,0.997680574514419
"B Cell Proliferation (GO:0042100)",0.998145188853885,0.998242947700042,0.00121733526685922,0.998653351369565
"B Cell Receptor Signaling Pathway (GO:0050853)",0.997317989145548,0.997296847162279,0.0012002260470209,0.998186907103153
"BMP Signaling Pathway (GO:0030509)",0.994666308158995,0.994769435749954,0.00211866379276382,0.996256312346615
"COPII Vesicle Coating (GO:0048208)",0.991769471926373,0.991932344992579,0.00441165545920721,0.997174481732483
"COPII-coated Vesicle Budding (GO:0090114)",0.990868972172121,0.991297764805594,0.00312006851389935,0.996574845137784
"COPII-coated Vesicle Cargo Loading (GO:0090110)",0.986870056286758,0.986363870633305,0.00266013086604779,0.994860956701143
"DNA Alkylation (GO:0006305)",0.990564383678837,0.990624177772348,0.00403799700938685,0.994576645437299
"DNA Biosynthetic Process (GO:0071897)",0.973618982259871,0.976895368726107,0.0144564708816278,0.98682769448528
"DNA Catabolic Process (GO:0006308)",0.996978111658195,0.996945392057222,0.00122734560694257,0.998048561841476
"DNA Conformation Change (GO:0071103)",0.99825539168603,0.998321604161414,0.000644801201895367,0.99886151938567
"DNA Damage Checkpoint Signaling (GO:0000077)",0.964412340276526,0.966622984612193,0.00899203578456166,0.984820167711096
"DNA Damage Response, Signal Transduction By P53 Class Mediator (GO:0030330)",0.997618578984045,0.998045823938167,0.000986985321724168,0.998445724656895
"DNA Damage Response, Signal Transduction By P53 Class Mediator Resulting In Cell Cycle Arrest (GO:0006977)",0.999118377399612,0.999142133371571,0.000379423841387327,0.99936732569948
"DNA Deamination (GO:0045006)",0.984615075682029,0.986254715921943,0.00967742343254756,0.992467623812451
"DNA Double-Strand Break Processing (GO:0000729)",0.988381103567787,0.988441799800983,0.00611145575233308,0.993699362667373
"DNA Duplex Unwinding (GO:0032508)",0.986126564162186,0.986927838855321,0.00277041171397668,0.992525190086366
"DNA Geometric Change (GO:0032392)",0.997324779961048,0.997615359138854,0.00119274712803445,0.998353294955895
"DNA Integrity Checkpoint Signaling (GO:0031570)",0.962929927664992,0.964634163758141,0.00919690879366482,0.982052790130659
"DNA Methylation (GO:0006306)",0.988556638703086,0.988161437112755,0.00497335019381661,0.993248902293949
"DNA Modification (GO:0006304)",0.979434427930575,0.982565573151796,0.00880790574317951,0.989935815803457
"DNA Recombination (GO:0006310)",0.995058008112387,0.994875021447109,0.00125938916350121,0.99688582698914
"DNA Repair-Dependent Chromatin Remodeling (GO:0140861)",0.980691567725244,0.982544030046462,0.00862392563939336,0.994063137371102
"DNA Replication (GO:0006260)",0.988786122286936,0.98836903805719,0.00202793491170759,0.993942301482136
"DNA Replication Checkpoint Signaling (GO:0000076)",0.976444649191532,0.976269647553801,0.0119876904737747,0.987725167100803
"DNA Replication Initiation (GO:0006270)",0.939046398298414,0.936378149280084,0.0195119037234546,0.97634366434381
"DNA Strand Elongation (GO:0022616)",0.954483489373079,0.95888832050961,0.0169583105570937,0.98611136429103
"DNA Strand Elongation Involved In DNA Replication (GO:0006271)",0.959842167790733,0.968209435338238,0.018119133506941,0.986109332185904
"DNA Synthesis Involved In DNA Repair (GO:0000731)",0.979497028535429,0.979890081265758,0.0066818270862827,0.990331515594029
"DNA Unwinding Involved In DNA Replication (GO:0006268)",0.992849247532534,0.99315524535957,0.00215715030582396,0.995890040636987
"DNA-templated DNA Replication (GO:0006261)",0.979051578022487,0.980324361313532,0.00320106233222254,0.989512364730779
"DNA-templated DNA Replication Maintenance Of Fidelity (GO:0045005)",0.987545479525684,0.988120472719271,0.00435489574304137,0.992332434467612
"DNA-templated Transcription Elongation (GO:0006354)",0.982673228365451,0.984808329812288,0.00654103897250906,0.994343468070098
"DNA-templated Transcription Initiation (GO:0006352)",0.991952594821976,0.992378757402797,0.00191271951165614,0.995685516473622
"DNA-templated Transcription Termination (GO:0006353)",0.984983702594763,0.987461082581768,0.011186084227491,0.99392664629523
"ERAD Pathway (GO:0036503)",0.98707240786057,0.987136140890467,0.00291338887511054,0.994514591034275
"ERBB Signaling Pathway (GO:0038127)",0.983379447741919,0.984584251272274,0.00613026598251139,0.99055033141289
"ERK1 And ERK2 Cascade (GO:0070371)",0.99775932550896,0.997735334320467,0.00101705283149423,0.998627395393852
"Fc Receptor Mediated Stimulatory Signaling Pathway (GO:0002431)",0.99747437371174,0.997967765222882,0.00117868586992097,0.998158916620069
"Fc Receptor Signaling Pathway (GO:0038093)",0.994979068571174,0.996079902299614,0.00328517740522099,0.996693718316307
"Fc-epsilon Receptor Signaling Pathway (GO:0038095)",0.892904659599228,0.912757278543486,0.060917910011345,0.959072806057026
"Fc-gamma Receptor Signaling Pathway (GO:0038094)",0.997854207770032,0.998196039877848,0.00133565950340926,0.998552138479092
"Fc-gamma Receptor Signaling Pathway Involved In Phagocytosis (GO:0038096)",0.998449043305404,0.998843451705374,0.000755830365142683,0.998832128475928
"G Protein-Coupled Receptor Signaling Pathway, Coupled To Cyclic Nucleotide Second Messenger (GO:0007187)",0.999847699906217,0.999857542208038,9.85571813122901e-05,0.999880986256926
"G1/S Transition Of Mitotic Cell Cycle (GO:0000082)",0.976137304064278,0.976412781786856,0.00579618699314294,0.988785425326898
"G2/M Transition Of Mitotic Cell Cycle (GO:0000086)",0.986430939019017,0.988430968173126,0.00570850118254782,0.992614341185097
"GPI Anchor Biosynthetic Process (GO:0006506)",0.969887661691976,0.972814322989721,0.0120998696956183,0.98698237462549
"GPI Anchor Metabolic Process (GO:0006505)",0.976117952051056,0.976449936156764,0.00948599539974001,0.988096639910353
"GTP Metabolic Process (GO:0046039)",0.998796415051919,0.99906980320972,0.000728458331644997,0.999257819901929
"Golgi To Endosome Transport (GO:0006895)",0.963689282800937,0.962768743301985,0.0199518416612815,0.985045458974068
"Golgi To Plasma Membrane Protein Transport (GO:0043001)",0.98818984179367,0.989136963510957,0.00456003683838665,0.994703828865761
"Golgi To Plasma Membrane Transport (GO:0006893)",0.983247283171232,0.983282141528961,0.00317594130346521,0.992182405782719
"Golgi To Vacuole Transport (GO:0006896)",0.996375288510085,0.996450618039987,0.0016669825416717,0.997830782814309
"I-kappaB kinase/NF-kappaB Signaling (GO:0007249)",0.988702703610301,0.989547591076646,0.00381323747147181,0.993810029756929
"JNK Cascade (GO:0007254)",0.983093515182103,0.983026120681677,0.00866334113125254,0.991106963787099
"L-alpha-amino Acid Transmembrane Transport (GO:1902475)",0.993553627290567,0.994172211053377,0.00247423230254011,0.995669666157174
"L-amino Acid Transport (GO:0015807)",0.995092197851249,0.994691499222539,0.00247980205959533,0.996890427803083
"L-serine Metabolic Process (GO:0006563)",0.985722070194554,0.986890440603818,0.00960137918724622,0.990589448578182
"MAPK Cascade (GO:0000165)",0.994997233633568,0.995093799573635,0.00114108266464808,0.996996160204742
"MHC Class II Protein Complex Assembly (GO:0002399)",0.976508424916833,0.979899813433282,0.0170401538676398,0.986433626994726
"MyD88-dependent Toll-Like Receptor Signaling Pathway (GO:0002755)",0.996303426722381,0.996826768509944,0.00244819929528035,0.997523638208128
"N-glycan Processing (GO:0006491)",0.961620332217351,0.968639439450926,0.0202665831012267,0.982821380577862
"N-terminal Protein Amino Acid Acetylation (GO:0006474)",0.984120697628492,0.987615739996094,0.00801400761672712,0.991785038181808
"N-terminal Protein Amino Acid Modification (GO:0031365)",0.985759845326842,0.986447384027842,0.00617912177112821,0.994133916353048
"NAD Biosynthetic Process (GO:0009435)",0.933162918952146,0.928644056140613,0.0274320485369558,0.971533796501778
"NAD Metabolic Process (GO:0019674)",0.995706750402036,0.996082439993922,0.00158763566704455,0.997190421890783
"NADH Dehydrogenase Complex Assembly (GO:0010257)",0.989188074892511,0.988458922951951,0.00213678105631098,0.99739538396019
"NADP Metabolic Process (GO:0006739)",0.993935330020789,0.99515029564007,0.0034193207968524,0.995921364342773
"NIK/NF-kappaB Signaling (GO:0038061)",0.993230584052421,0.994292532640251,0.00303034207205886,0.996087340468532
"NLS-bearing Protein Import Into Nucleus (GO:0006607)",0.912193146300211,0.929507739502067,0.0529063934904913,0.98258642784617
"Notch Signaling Pathway (GO:0007219)",0.989236849120011,0.99038646454995,0.00496349126470736,0.992931425361466
"O-glycan Processing (GO:0016266)",0.936354617791826,0.941257754614714,0.027960333026689,0.971240927371389
"P-body Assembly (GO:0033962)",0.991527944254832,0.990952857369082,0.00435748603625047,0.996419361819748
"RNA 3'-End Processing (GO:0031123)",0.984547264060492,0.985057121744569,0.00551928985298618,0.992479189476858
"RNA Biosynthetic Process (GO:0032774)",0.996246437126544,0.996190429083072,0.00124714647642618,0.997774493621039
"RNA Catabolic Process (GO:0006401)",0.995537750722393,0.99545987959298,0.00113746957658425,0.997700751422961
"RNA Destabilization (GO:0050779)",0.97484203240549,0.977448649042329,0.0135381139649672,0.989219398704205
"RNA Export From Nucleus (GO:0006405)",0.99521264829955,0.995234012500848,0.000803956935331364,0.997450639230017
"RNA Methylation (GO:0001510)",0.991252163978233,0.990697457737375,0.00238367703723794,0.995477494805247
"RNA Modification (GO:0009451)",0.985249020511734,0.985062857801394,0.00353357925123178,0.992198867069747
"RNA Phosphodiester Bond Hydrolysis (GO:0090501)",0.967317123972757,0.968786584347708,0.00795790755415718,0.987433681431297
"RNA Phosphodiester Bond Hydrolysis, Endonucleolytic (GO:0090502)",0.964546717534159,0.964280992714458,0.0150633308852823,0.98862896627957
"RNA Polyadenylation (GO:0043631)",0.998339133520705,0.998486308093888,0.000590153713642058,0.998933993511903
"RNA Polymerase II Preinitiation Complex Assembly (GO:0051123)",0.987390734458285,0.988868258981618,0.00316084151242174,0.994524910637912
"RNA Splicing (GO:0008380)",0.987174906709295,0.987250229583791,0.00191222044757329,0.996087553531106
"RNA Splicing, Via Endonucleolytic Cleavage And Ligation (GO:0000394)",0.952451333654602,0.964431020820524,0.0373804402212217,0.988599067355637
"RNA Splicing, Via Transesterification Reactions (GO:0000375)",0.977723959208171,0.977770671640622,0.00824353404039165,0.994286216835944
"RNA Stabilization (GO:0043489)",0.998415641472235,0.998536278310647,0.000453881572312767,0.999046397040015
"RNA Transport (GO:0050658)",0.998169214999969,0.998266263336419,0.000373591393303533,0.998950042618568
"RNA-mediated Gene Silencing (GO:0031047)",0.999196257875386,0.999281565825523,0.000297896559232348,0.999375393680384
"RNA-templated DNA Biosynthetic Process (GO:0006278)",0.996142787129474,0.996132665052302,0.00125519722873167,0.998344747252865
"Rac Protein Signal Transduction (GO:0016601)",0.997606828890894,0.997434599066304,0.000731350573858249,0.998624449287368
"Rho Protein Signal Transduction (GO:0007266)",0.998109062154121,0.997975790474898,0.000675036436679302,0.998829796812904
"SCF-dependent Proteasomal Ubiquitin-Dependent Protein Catabolic Process (GO:0031146)",0.995701279055936,0.996312298214146,0.00170281311226057,0.997174482804453
"SMAD Protein Signal Transduction (GO:0060395)",0.972871213585544,0.973130095891607,0.00934169871341466,0.982277796162276
"T Cell Activation (GO:0042110)",0.997742743226817,0.997654816360736,0.000356225293177681,0.998731699935597
"T Cell Activation Involved In Immune Response (GO:0002286)",0.997713566929981,0.997720050370934,0.00104578071117198,0.998394862219889
"T Cell Differentiation (GO:0030217)",0.99836020754002,0.998367505927342,0.00031061739167664,0.99907399617699
"T Cell Differentiation In Thymus (GO:0033077)",0.998736172174819,0.998816816754015,0.000956680341554171,0.999307417627396
"T Cell Homeostasis (GO:0043029)",0.965754589857418,0.963921361353497,0.0182969609711976,0.987825043559619
"T Cell Mediated Immunity (GO:0002456)",0.998951180300051,0.998976160560758,0.000413993533783017,0.999228210419722
"T Cell Migration (GO:0072678)",0.99613629024772,0.996590766293961,0.0014646860065125,0.997666402318735
"T Cell Proliferation (GO:0042098)",0.994875675527134,0.994973858872768,0.00246898901737526,0.996896693726666
"T Cell Receptor Signaling Pathway (GO:0050852)",0.996931304319816,0.996952865893303,0.000578527225159219,0.99819145905033
"T-helper Cell Differentiation (GO:0042093)",0.997754172833246,0.997606613307688,0.000790481728279837,0.998997467966514
"T-helper Cell Lineage Commitment (GO:0002295)",0.994828510055298,0.995818823232086,0.00402834937334928,0.99706884031164
"TOR Signaling (GO:0031929)",0.99866808969057,0.998834269099185,0.000670038908719838,0.999129030048994
"TORC1 Signaling (GO:0038202)",0.996495117035152,0.996755100231381,0.00189208690358962,0.998495186653932
"U2-type Prespliceosome Assembly (GO:1903241)",0.985191726276036,0.98463539041467,0.00589318423394769,0.996850752726486
"UV-damage Excision Repair (GO:0070914)",0.913625510808105,0.909421585901004,0.0427456021404318,0.970436039296035
"V(D)J Recombination (GO:0033151)",0.998636764767443,0.998732526686405,0.000867329263298466,0.99913964055645
"Wnt Signaling Pathway (GO:0016055)",0.98202019288447,0.983915653390764,0.00748837264000152,0.989173346183889
"Wnt Signaling Pathway, Planar Cell Polarity Pathway (GO:0060071)",0.996667478981266,0.996848917067863,0.00198890709805822,0.997831008987781
"acetyl-CoA Biosynthetic Process (GO:0006085)",0.984705333264997,0.988314111195959,0.00816671915543296,0.99338345211397
"acetyl-CoA Metabolic Process (GO:0006084)",0.989459906325659,0.990258976874065,0.00374069479655734,0.994130467011371
"Actin Cytoskeleton Reorganization (GO:0031532)",0.997211807645729,0.99720991267071,0.0012808858338935,0.998117151752311
"Actin Filament Bundle Assembly (GO:0051017)",0.997588294104483,0.997588604843919,0.00112061292765952,0.998390972017195
"Actin Filament Bundle Organization (GO:0061572)",0.997798541270424,0.997852575822182,0.00119940908724098,0.998475531564189
"Actin Filament Capping (GO:0051693)",0.988710728874092,0.988805111542173,0.00483643759258775,0.993993789513986
"Actin Filament Depolymerization (GO:0030042)",0.991062902092474,0.9936396179833,0.00819089029034891,0.995502416701186
"Actin Filament Organization (GO:0007015)",0.993973423757797,0.994234411215722,0.00144765837153344,0.996505640573168
"Actin Filament Polymerization (GO:0030041)",0.987987335088606,0.989947102344448,0.0073477230815927,0.992338832337662
"Actin Filament-Based Transport (GO:0099515)",0.989964536144786,0.988650631363087,0.00463136385381181,0.993820515997846
"Actin Nucleation (GO:0045010)",0.998009353347202,0.998076224571014,0.00149749199898171,0.999183486258823
"Actin Polymerization Or Depolymerization (GO:0008154)",0.995080349083873,0.99459259768001,0.00204077500318611,0.996953412354389
"Action Potential (GO:0001508)",0.996727402002274,0.998272820403541,0.00339039061669276,0.997597160366746
"Activation Of GTPase Activity (GO:0090630)",0.994832266690152,0.994789393289796,0.00141825815524264,0.996355790981376
"Activation Of NF-kappaB-inducing Kinase Activity (GO:0007250)",0.979682873320666,0.984171214501727,0.0125819246066109,0.987962161525101
"Activation Of Cysteine-Type Endopeptidase Activity (GO:0097202)",0.986458996644102,0.988383561837992,0.00696966793758607,0.994410773858562
"Activation Of Cysteine-Type Endopeptidase Activity Involved In Apoptotic Process (GO:0006919)",0.994953302390895,0.99494313120029,0.000912233343386019,0.997271503900016
"Activation Of Phospholipase C Activity (GO:0007202)",0.997288063069238,0.99807558341705,0.00193456121652788,0.99805614971193
"Activation Of Protein Kinase B Activity (GO:0032148)",0.997635012340608,0.998172979109173,0.00146130974382896,0.998612397680279
"Activation Of Protein Kinase Activity (GO:0032147)",0.994254177057208,0.994947209874091,0.00296865750391951,0.996091031156563
"Actomyosin Structure Organization (GO:0031032)",0.988878267749325,0.988495477634702,0.00487570294797813,0.99322854417122
"Acute Inflammatory Response (GO:0002526)",0.994064614714116,0.995151808455583,0.00304985855497766,0.996267371863838
"acyl-CoA Biosynthetic Process (GO:0071616)",0.985994410333733,0.989286642359611,0.00891037480453881,0.993707021839473
"acyl-CoA Metabolic Process (GO:0006637)",0.912510720398625,0.936508509179433,0.0619612922119745,0.965374200355867
"Acylglycerol Biosynthetic Process (GO:0046463)",0.942207697158288,0.949329623204786,0.0288069064659238,0.969781061364464
"Acylglycerol Catabolic Process (GO:0046464)",0.989137861094617,0.993076920575066,0.00770920389254435,0.992583203611902
"Acylglycerol Homeostasis (GO:0055090)",0.995439433857385,0.995898593546963,0.00425643692123583,0.997161132817441
"Acylglycerol Metabolic Process (GO:0006639)",0.980646801577067,0.98003681627238,0.00708714345842246,0.988389367516982
"Adaptive Immune Response Based On Somatic Recombination Of Immune Receptors Built From Immunoglobulin Superfamily Domains (GO:0002460)",0.98670843668343,0.988809099385182,0.00560811208799311,0.99367667943278
"Adenine Nucleotide Transport (GO:0051503)",0.996722473141143,0.996696814014393,0.00146213642367025,0.99766949387134
"Adenylate Cyclase-Activating G Protein-Coupled Receptor Signaling Pathway (GO:0007189)",0.995411936884801,0.995403226243487,0.00219040548125374,0.996792004305983
"Adenylate Cyclase-Inhibiting G Protein-Coupled Receptor Signaling Pathway (GO:0007193)",0.997314485239531,0.99752492672184,0.00100632205568575,0.998252721117818
"Adenylate Cyclase-Modulating G Protein-Coupled Receptor Signaling Pathway (GO:0007188)",0.996259888625365,0.996694286810188,0.00147279328459312,0.997448326362975
"Adherens Junction Organization (GO:0034332)",0.973890595336413,0.976255847666056,0.0113453727951674,0.986398121148965
"Adipose Tissue Development (GO:0060612)",0.99420097518083,0.995546233733092,0.00472996582419583,0.996377556076982
"Aerobic Electron Transport Chain (GO:0019646)",0.992006180362354,0.991815118427007,0.00158044273558409,0.998560575208481
"Aerobic Respiration (GO:0009060)",0.991093700178355,0.991891526566458,0.00239301561043243,0.998045770681863
"Alpha-Amino Acid Catabolic Process (GO:1901606)",0.957748473705093,0.966326730753398,0.0225556404479862,0.979400657087303
"Alpha-Amino Acid Metabolic Process (GO:1901605)",0.860808484525737,0.847384234702656,0.0576583701103144,0.941018373777931
"Alpha-Beta T Cell Activation (GO:0046631)",0.999084450638842,0.999099612993736,0.000514704208363988,0.999536367425427
"Alternative mRNA Splicing, Via Spliceosome (GO:0000380)",0.985913483992208,0.988671812260797,0.00601339776000819,0.996879708431301
"Ameboidal-Type Cell Migration (GO:0001667)",0.979216475140475,0.977945305261051,0.0153830277450616,0.989161508239399
"Amide Biosynthetic Process (GO:0043604)",0.986538392074583,0.98798074314791,0.00689626693778831,0.991777749356902
"Amide Transport (GO:0042886)",0.993926790891026,0.993812889057991,0.0034812566485501,0.995813674080754
"Amino Acid Catabolic Process (GO:0009063)",0.966343745123631,0.97030632465168,0.0135660201392338,0.982636826560334
"Amino Acid Import Across Plasma Membrane (GO:0089718)",0.997844065010445,0.998131073363088,0.00078779051366721,0.998274433883319
"Amino Acid Transmembrane Transport (GO:0003333)",0.978778925826506,0.98026096135305,0.00741661871449109,0.988045021756226
"Amino Acid Transport (GO:0006865)",0.994266064278621,0.994231141605078,0.00211437803299605,0.996085949789201
"Aminoglycan Biosynthetic Process (GO:0006023)",0.958484358095941,0.965913704502192,0.0189416357134165,0.980440428230831
"Amyloid Fibril Formation (GO:1990000)",0.999549964944107,0.999584518301153,0.000232010628603748,0.999685533676567
"Amyloid Precursor Protein Catabolic Process (GO:0042987)",0.984756149007489,0.986099734010019,0.00924657228262689,0.992764764356433
"Amyloid Precursor Protein Metabolic Process (GO:0042982)",0.986116612531311,0.987560889524836,0.00770389423542543,0.993167298193498
"Amyloid-Beta Metabolic Process (GO:0050435)",0.985257090050989,0.987307576591052,0.00679468677360923,0.992448701558863
"Anaphase-Promoting Complex-Dependent Catabolic Process (GO:0031145)",0.991990210893752,0.993616861950786,0.00386294069865019,0.995711787221507
"Androgen Receptor Signaling Pathway (GO:0030521)",0.994236002667201,0.995545381563204,0.00294776322629406,0.996828637089676
"Anterior/Posterior Pattern Specification (GO:0009952)",0.994313644081666,0.995100183960118,0.00367567250061483,0.995996208260255
"Anterograde Axonal Transport (GO:0008089)",0.992670085180596,0.992800696804967,0.00230291864075677,0.995903715773426
"Anterograde Synaptic Vesicle Transport (GO:0048490)",0.985232242576929,0.986359674016935,0.00529025816474055,0.994634737768268
"Anterograde Trans-Synaptic Signaling (GO:0098916)",0.992100626844568,0.991475439056565,0.00183865330320707,0.994697089138371
"Antibacterial Humoral Response (GO:0019731)",0.999810627257982,0.999839535188338,0.000101123266467382,0.999880584399749
"Antigen Processing And Presentation Of Endogenous Peptide Antigen (GO:0002483)",0.999416403896338,0.999475040491204,0.000252952926361923,0.999678874174407
"Antigen Processing And Presentation Of Exogenous Peptide Antigen (GO:0002478)",0.997962691447283,0.998127427834877,0.000928489077903972,0.998625438364062
"Antigen Processing And Presentation Of Exogenous Peptide Antigen Via MHC Class II (GO:0019886)",0.96884583628654,0.974266834738548,0.0178790145586503,0.984233883043521
"Antigen Processing And Presentation Of Peptide Antigen Via MHC Class I (GO:0002474)",0.999572705502599,0.999610050475938,0.000138518645372113,0.999709056590985
"Antigen Processing And Presentation Of Peptide Antigen Via MHC Class II (GO:0002495)",0.96884583628654,0.974266834738548,0.0178790145586503,0.984233883043521
"Antigen Receptor-Mediated Signaling Pathway (GO:0050851)",0.996632510381323,0.996891921634644,0.000688912028457279,0.997919157159478
"Antimicrobial Humoral Immune Response Mediated By Antimicrobial Peptide (GO:0061844)",0.999557849401068,0.99956716129147,0.000177962759817238,0.999694509583474
"Antimicrobial Humoral Response (GO:0019730)",0.999615213259689,0.999621512015956,0.000117678301494337,0.999738992357601
"Antiviral Innate Immune Response (GO:0140374)",0.961053233267177,0.969698648798756,0.0234462910294365,0.983090740493716
"Aorta Morphogenesis (GO:0035909)",0.992111369661062,0.993635338036811,0.00706280004535169,0.994896001616543
"Aortic Valve Development (GO:0003176)",0.986876824928525,0.98605111938874,0.00373369908911416,0.99303826305182
"Aortic Valve Morphogenesis (GO:0003180)",0.994949824794997,0.995146447134751,0.00218594872783104,0.996856676931341
"Apical Junction Assembly (GO:0043297)",0.992237552812529,0.992600515268281,0.00341641688746686,0.99527613306142
"Apoptotic Cell Clearance (GO:0043277)",0.999484360326683,0.999565254744966,0.000288225010840253,0.9996322938416
"Apoptotic Mitochondrial Changes (GO:0008637)",0.984480500192417,0.986600990781402,0.00670160348284217,0.993803848427579
"Apoptotic Nuclear Changes (GO:0030262)",0.976641689430646,0.975316941267194,0.0111935859794312,0.990947026703373
"Arachidonic Acid Metabolic Process (GO:0019369)",0.996950678821697,0.99701113187177,0.00139916937940315,0.9979932758194
"Artery Development (GO:0060840)",0.97881910818067,0.98066738452637,0.0130615431775596,0.986487374886398
"Artery Morphogenesis (GO:0048844)",0.933450972830436,0.95213283361841,0.0577829863324835,0.958540205687908
"Astrocyte Activation (GO:0048143)",0.988841112649751,0.991863945123075,0.0106759166622433,0.992921108615078
"Astrocyte Development (GO:0014002)",0.987988624513375,0.991588208696833,0.0081398599887641,0.99274947404636
"Atrioventricular Valve Morphogenesis (GO:0003181)",0.938484445343853,0.946402735101806,0.038416917143071,0.965717693853274
"Attachment Of Mitotic Spindle Microtubules To Kinetochore (GO:0051315)",0.984118879396306,0.985028510990295,0.00642733494605904,0.992072787788089
"Autophagosome Assembly (GO:0000045)",0.98721873716996,0.986867153367936,0.00198375350490485,0.994189309719282
"Autophagosome Maturation (GO:0097352)",0.989566622272808,0.990364627469715,0.00553464604480208,0.995423940174246
"Autophagosome Organization (GO:1905037)",0.98824947365991,0.987896243966707,0.00199906053351619,0.994531995440549
"Autophagy Of Mitochondrion (GO:0000422)",0.987892243471537,0.987942343325724,0.00195905989741709,0.994912454265135
"Autophagy Of Nucleus (GO:0044804)",0.988894549564915,0.989349025171009,0.00346590691409438,0.994243368143852
"Axon Development (GO:0061564)",0.995940688386666,0.996327370928886,0.00125709436156865,0.997158576087755
"Axon Extension (GO:0048675)",0.997357598726897,0.998266245577458,0.00178679418047301,0.998502595500483
