"Pathway","R2mean","R2median","R2sd","V1VE"
"Innate Immune Response Activating Cell Surface Receptor Signaling Pathway (GO:0002220)",0.996070878614282,0.996479099484625,0.00192127661394079,0.997132291426758
"Innate Immune Response-Activating Signaling Pathway (GO:0002758)",0.976229897717323,0.976496334759786,0.0159241370252527,0.984854605708272
"Inner Mitochondrial Membrane Organization (GO:0007007)",0.989614353021738,0.989355265736505,0.00232448345822173,0.995689902301887
"Inorganic Anion Transmembrane Transport (GO:0098661)",0.994210288836469,0.994853778920239,0.00193334476402068,0.995736878677587
"Inorganic Anion Transport (GO:0015698)",0.996715006229942,0.997244770044344,0.00166769104946249,0.99761359186544
"Inorganic Cation Import Across Plasma Membrane (GO:0098659)",0.99135359266595,0.994109761145006,0.00472065315260128,0.993903104434715
"Inositol Lipid-Mediated Signaling (GO:0048017)",0.995456847039107,0.995946831807617,0.00269283651847768,0.99663125607046
"Inositol Phosphate Metabolic Process (GO:0043647)",0.944669112756239,0.946674783154096,0.0153106992687596,0.974203243503387
"Inositol Phosphate-Mediated Signaling (GO:0048016)",0.944713716208005,0.954642902880933,0.0297089261614044,0.977596368046372
"Insulin Receptor Signaling Pathway (GO:0008286)",0.988697460140473,0.990175229597233,0.00407414197891284,0.993147691386892
"Insulin Secretion (GO:0030073)",0.999154646215576,0.999275749167748,0.000471230557150059,0.999429856479984
"Integrated Stress Response Signaling (GO:0140467)",0.992195940157117,0.992282245539664,0.00247713704800242,0.995821621979258
"Integrin-Mediated Signaling Pathway (GO:0007229)",0.98728279248834,0.99005732260262,0.00877720016002952,0.992586420187139
"Interferon-Mediated Signaling Pathway (GO:0140888)",0.991639648116402,0.992132872611447,0.00310867068007604,0.99569532688765
"Interleukin-1-Mediated Signaling Pathway (GO:0070498)",0.955081979076999,0.956648939471602,0.0130529441797872,0.981460606449769
"Interleukin-15-Mediated Signaling Pathway (GO:0035723)",0.99859881076119,0.998943770689898,0.00117624198384557,0.999198758333828
"Interleukin-6-Mediated Signaling Pathway (GO:0070102)",0.998216313768183,0.998550322570414,0.00126479421124834,0.99875625952701
"Intermediate Filament Organization (GO:0045109)",0.998757535793782,0.999092622462743,0.000982048833184262,0.999123878868154
"Internal Peptidyl-Lysine Acetylation (GO:0018393)",0.989415774073329,0.988888585918657,0.00298310015207588,0.995330706809217
"Interstrand Cross-Link Repair (GO:0036297)",0.979970621828995,0.979881242208554,0.007301727769583,0.988227175096181
"intra-Golgi Vesicle-Mediated Transport (GO:0006891)",0.989805394435971,0.990448668170459,0.00369451236347081,0.99529435347851
"Intracellular Calcium Ion Homeostasis (GO:0006874)",0.996227153236519,0.996577424890075,0.00122345769083652,0.9974113737381
"Intracellular Cholesterol Transport (GO:0032367)",0.992877861520209,0.993495932002783,0.00388488373784221,0.995853086610328
"Intracellular Estrogen Receptor Signaling Pathway (GO:0030520)",0.9923890547713,0.993482051880812,0.00377790065144882,0.99632005002564
"Intracellular Glucose Homeostasis (GO:0001678)",0.989509621004577,0.990013058812253,0.00391546843678028,0.993944759204839
"Intracellular Iron Ion Homeostasis (GO:0006879)",0.999627682836923,0.999629895853098,0.000146177907746016,0.999748364072955
"Intracellular Lipid Transport (GO:0032365)",0.987073523634415,0.990274978502845,0.0097313141128167,0.992217460768565
"Intracellular Monoatomic Ion Homeostasis (GO:0006873)",0.969689512922287,0.972850235684784,0.0150531474591536,0.986458136659607
"Intracellular pH Reduction (GO:0051452)",0.996259482417664,0.996579730934359,0.00173366896714684,0.997824131527902
"Intracellular Protein Transmembrane Transport (GO:0065002)",0.986639316985272,0.986804000265074,0.00399401235208058,0.99371588456183
"Intracellular Steroid Hormone Receptor Signaling Pathway (GO:0030518)",0.988357533937543,0.988290830487487,0.00424313172701472,0.994259241903128
"Intracellular Sterol Transport (GO:0032366)",0.990064348220217,0.991436235065783,0.00609432087667148,0.994354826295393
"Intracellular Zinc Ion Homeostasis (GO:0006882)",0.994949456426847,0.995474068662485,0.00356840027510294,0.99673803050294
"Intraciliary Anterograde Transport (GO:0035720)",0.986604412864219,0.986436181672512,0.0050658682179768,0.993665065705634
"Intraciliary Retrograde Transport (GO:0035721)",0.997631969109736,0.997719728936713,0.00147895403576353,0.998265256335181
"Intrinsic Apoptotic Signaling Pathway (GO:0097193)",0.992584490437791,0.992708679491494,0.00126969892780548,0.995890505030636
"Intrinsic Apoptotic Signaling Pathway By P53 Class Mediator (GO:0072332)",0.996455915970922,0.996530793855124,0.000886319978880381,0.997935271038556
"Intrinsic Apoptotic Signaling Pathway In Response To DNA Damage (GO:0008630)",0.992588820533071,0.992653320230488,0.00193337062402243,0.995862102552366
"Intrinsic Apoptotic Signaling Pathway In Response To DNA Damage By P53 Class Mediator (GO:0042771)",0.99452363637003,0.994937253407707,0.00219311265752874,0.996953973580453
"Intrinsic Apoptotic Signaling Pathway In Response To Endoplasmic Reticulum Stress (GO:0070059)",0.985803940056575,0.987802486641581,0.00575801444888419,0.993990000797045
"Intrinsic Apoptotic Signaling Pathway In Response To Oxidative Stress (GO:0008631)",0.976111752965921,0.98081112646451,0.0159026753717912,0.990208109612668
"Iron Ion Transport (GO:0006826)",0.999700457763434,0.999739088006142,0.000175301372018132,0.999768397929391
"Iron-Sulfur Cluster Assembly (GO:0016226)",0.992107139075501,0.992900695773082,0.00360566429608173,0.996590298740522
"Isotype Switching (GO:0045190)",0.98393503139817,0.984173099614584,0.011302290583205,0.992920566354012
"Keratan Sulfate Biosynthetic Process (GO:0018146)",0.938409281587884,0.957941000162494,0.0531038887045062,0.968638687776697
"Keratan Sulfate Metabolic Process (GO:0042339)",0.984688943444313,0.987128811612012,0.0115472380493705,0.990056077984703
"Keratinocyte Differentiation (GO:0030216)",0.999048255312174,0.99905502528617,0.000298521862192625,0.999321090952426
"Kidney Development (GO:0001822)",0.987655788967822,0.988848519881082,0.00514161683123471,0.993036664922907
"Lamellipodium Assembly (GO:0030032)",0.987450133710256,0.988471100644977,0.00631540513001768,0.992793484477876
"Lamellipodium Organization (GO:0097581)",0.986197080774326,0.987936571827368,0.00627432804202208,0.992510914790508
"Late Endosome To Lysosome Transport (GO:1902774)",0.986029200570104,0.986524929351133,0.00439725617454817,0.99542734279419
"Late Endosome To Vacuole Transport (GO:0045324)",0.98640863810582,0.988339427135418,0.00968533820610394,0.995043548956054
"Late Endosome To Vacuole Transport Via Multivesicular Body Sorting Pathway (GO:0032511)",0.993027806023052,0.992778269629314,0.00325524088623747,0.996760534436188
"Learning (GO:0007612)",0.991602864197917,0.991992980348804,0.00354446449101758,0.994195748210051
"Left/Right Pattern Formation (GO:0060972)",0.991158079602764,0.990899253027387,0.00302118167939457,0.994477082076876
"Leukocyte Adhesion To Vascular Endothelial Cell (GO:0061756)",0.992615155861145,0.993001440892485,0.00310229719597973,0.995875843360696
"Leukocyte Cell-Cell Adhesion (GO:0007159)",0.992727752226757,0.99245537045722,0.00302324153703283,0.996263476091045
"Leukocyte Tethering Or Rolling (GO:0050901)",0.993492320005733,0.994181072941336,0.00304345565229659,0.996326005434742
"Leukotriene Metabolic Process (GO:0006691)",0.997364326147004,0.99788963185905,0.00177021088405526,0.998253201646649
"Limb Development (GO:0060173)",0.813879361720188,0.820866944499303,0.0886919989278527,0.906483699821621
"Limb Morphogenesis (GO:0035108)",0.980095060888017,0.984645698714335,0.0129214296700952,0.988350758886211
"Linoleic Acid Metabolic Process (GO:0043651)",0.993766798615614,0.996169199718902,0.00639418519812475,0.996198043758673
"Lipid Biosynthetic Process (GO:0008610)",0.989966947727524,0.990107934147979,0.00260938528078442,0.993821650542937
"Lipid Droplet Formation (GO:0140042)",0.987426447914177,0.989076481577669,0.00720562417325653,0.992528299960771
"Lipid Droplet Organization (GO:0034389)",0.991357315914471,0.992109777290144,0.00346127733599028,0.995628018327
"Lipid Modification (GO:0030258)",0.850644700648317,0.885420290867718,0.09212780765436,0.929171232868858
"Lipid Translocation (GO:0034204)",0.954797576683012,0.956385041953028,0.0178996110184697,0.971172835761865
"Lipid Transport (GO:0006869)",0.990905005936765,0.990249453213132,0.00281256258458062,0.994480654569756
"Lipopolysaccharide-Mediated Signaling Pathway (GO:0031663)",0.991822683857167,0.993843158418946,0.0050250592805235,0.995368769187544
"Lipoprotein Biosynthetic Process (GO:0042158)",0.984076542657826,0.984637363500549,0.00602059219748609,0.992936216229354
"Lipoprotein Localization (GO:0044872)",0.984654266898257,0.987008949547734,0.00747974230510375,0.993166401782523
"Lipoprotein Transport (GO:0042953)",0.986515917084608,0.988763180442876,0.00688379990532937,0.993789221148227
"Liver Development (GO:0001889)",0.991663031120789,0.991971398994824,0.00319078309978475,0.995765499876864
"Long-Chain Fatty Acid Biosynthetic Process (GO:0042759)",0.999112209977487,0.999239300718179,0.000638460851063437,0.999400412645633
"Long-Chain Fatty Acid Metabolic Process (GO:0001676)",0.993139803846688,0.994457382357213,0.00315566785800567,0.995567214897601
"Long-Chain Fatty Acid Transport (GO:0015909)",0.93179959790918,0.942538031809624,0.0315934242867876,0.965672188012848
"Long-Chain fatty-acyl-CoA Biosynthetic Process (GO:0035338)",0.99058386911654,0.99050432478077,0.00610426564720444,0.994752178766987
"Long-Chain fatty-acyl-CoA Metabolic Process (GO:0035336)",0.989910692972945,0.988164503017116,0.00530045953144696,0.993993199212914
"Long-Term Memory (GO:0007616)",0.991332923991696,0.992385625320116,0.00582532733265035,0.995259794511845
"Long-Term Synaptic Potentiation (GO:0060291)",0.998345185908009,0.998472496580663,0.00106047876226542,0.998816576889127
"Lung Development (GO:0030324)",0.987519916331322,0.990226032670673,0.00637356180023214,0.992458922760312
"Lymphocyte Activation Involved In Immune Response (GO:0002285)",0.999079026620338,0.999063689125279,0.000506377520294921,0.99941639880829
"Lymphocyte Chemotaxis (GO:0048247)",0.996952179791812,0.997667553133602,0.00243805368565134,0.997731851094578
"Lymphocyte Differentiation (GO:0030098)",0.996780496440785,0.996775384647543,0.000716179968680319,0.998006687705688
"Lymphocyte Mediated Immunity (GO:0002449)",0.978943609510402,0.982083551912063,0.0106689460179282,0.990307640227381
"Lymphocyte Migration (GO:0072676)",0.991133603178117,0.992782717728994,0.00669578631313582,0.994767873977234
"Lymphocyte Proliferation (GO:0046651)",0.997568627440165,0.997682101624538,0.000884053361105209,0.998368484576684
"Lysosomal Lumen Acidification (GO:0007042)",0.993820818544054,0.994845083593876,0.00254788322616295,0.997237411633429
"Lysosomal Membrane Organization (GO:0097212)",0.987547391523186,0.987518809252706,0.00512443762430737,0.996115535738563
"Lysosomal Microautophagy (GO:0016237)",0.965444280117987,0.966888951925503,0.0181707107101645,0.981848370696943
"Lysosomal Transport (GO:0007041)",0.986047765738782,0.986875577878295,0.00563598689289543,0.992777288250022
"Lysosome Localization (GO:0032418)",0.985041343820996,0.98635513348369,0.00365834162758011,0.992680132214855
"Lysosome Organization (GO:0007040)",0.986694112824171,0.986170386057202,0.00307449377396556,0.992955565599281
"Lytic Vacuole Organization (GO:0080171)",0.969510565009217,0.96935041268127,0.00718343023596952,0.986276307939396
"mRNA 3'-End Processing (GO:0031124)",0.997317206157235,0.99736415181233,0.000771649938457816,0.998295810713001
"mRNA Catabolic Process (GO:0006402)",0.996466036193784,0.996707762465522,0.00118228780807489,0.998062395809168
"mRNA Cis Splicing, Via Spliceosome (GO:0045292)",0.984041996169241,0.983424000068888,0.00664828932491672,0.994751614731984
"mRNA Cleavage Involved In mRNA Processing (GO:0098787)",0.954795140287805,0.957065559933615,0.0145871983661517,0.987073131495158
"mRNA Destabilization (GO:0061157)",0.997078743273362,0.997236254712622,0.000899023849773578,0.998121557931442
"mRNA Export From Nucleus (GO:0006406)",0.990759446941974,0.990509527200716,0.00108118860315281,0.995773514382184
"mRNA Metabolic Process (GO:0016071)",0.995322957089766,0.99554034531151,0.000729752649286933,0.997897899398
"mRNA Methylation (GO:0080009)",0.971716843401262,0.968023993667902,0.0143916463269442,0.988238772662595
"mRNA Modification (GO:0016556)",0.954665800917076,0.952679645632344,0.0137288260376198,0.98305287744598
"mRNA Polyadenylation (GO:0006378)",0.998388623769649,0.998626144474298,0.000597276036266926,0.99896978947465
"mRNA Splice Site Recognition (GO:0006376)",0.987262178009853,0.987559510566015,0.0032018693412434,0.996005546372063
"mRNA Stabilization (GO:0048255)",0.998700595007169,0.998706887224815,0.000370564834890917,0.99926353593264
"mRNA Transcription (GO:0009299)",0.994736869574453,0.994839717928526,0.000761084097122234,0.997011520199186
"mRNA Transcription By RNA Polymerase II (GO:0042789)",0.993541347164893,0.993601839605143,0.000925086609393625,0.996327187779118
"mRNA Transport (GO:0051028)",0.994537295112955,0.99447884926967,0.000815800408081643,0.997264137800584
"Macroautophagy (GO:0016236)",0.984818864781511,0.985646906420472,0.00487571301212239,0.993292928663743
"Macromolecule Catabolic Process (GO:0009057)",0.986706501477727,0.988513487589332,0.00462421041313197,0.993342470658897
"Macromolecule Modification (GO:0043412)",0.995530144377757,0.995963154448354,0.00106037327613411,0.997349482314183
"Macrophage Activation (GO:0042116)",0.985623097331797,0.985532433199933,0.00612819632165193,0.990848404905495
"Macrophage Activation Involved In Immune Response (GO:0002281)",0.96612746456689,0.973328232884299,0.0304680771998503,0.984257631114599
"Macrophage Differentiation (GO:0030225)",0.993983050853562,0.994604616514062,0.00313162163554243,0.9969503194234
"Maintenance Of Blood-Brain Barrier (GO:0035633)",0.999096875269157,0.999168050249331,0.000483039837772382,0.999308921741997
"Maintenance Of Protein Localization In Organelle (GO:0072595)",0.995990762643341,0.996556056874145,0.00219750666563854,0.998108125207836
"Maintenance Of Protein Location In Nucleus (GO:0051457)",0.995855229328663,0.995759800880912,0.00154622190699155,0.997974292588183
"Male Gonad Development (GO:0008584)",0.995561171588533,0.995523978423915,0.00184429220569622,0.997410440043474
"Maturation Of 5.8S rRNA (GO:0000460)",0.981647133945839,0.982748483408191,0.00739803751006453,0.991181011016314
"Maturation Of 5.8S rRNA From Tricistronic rRNA Transcript (SSU-rRNA, 5.8S rRNA, LSU-rRNA) (GO:0000466)",0.994045977698745,0.994255879634209,0.00239748096183581,0.996370280678752
"Maturation Of LSU-rRNA (GO:0000470)",0.998847937046553,0.998812885103922,0.000364747236311431,0.99930284651192
"Maturation Of LSU-rRNA From Tricistronic rRNA Transcript (SSU-rRNA, 5.8S rRNA, LSU-rRNA) (GO:0000463)",0.999113039346286,0.999132944703495,0.000320927126501482,0.999472763469686
"Maturation Of SSU-rRNA (GO:0030490)",0.99914403097483,0.999116874432942,0.000258089451802374,0.999488814633713
"Maturation Of SSU-rRNA From Tricistronic rRNA Transcript (SSU-rRNA, 5.8S rRNA, LSU-rRNA) (GO:0000462)",0.999531603922275,0.999549006852724,0.000145911870105984,0.999717078498931
"Mature B Cell Differentiation Involved In Immune Response (GO:0002313)",0.998653840271708,0.998817437933112,0.000683326527303866,0.999075917936053
"Megakaryocyte Differentiation (GO:0030219)",0.984297660636733,0.98665996475061,0.0136178474438213,0.990204237327079
"Meiosis I (GO:0007127)",0.967358434789997,0.97223707380224,0.0255327346224468,0.982259591317389
"Melanosome Assembly (GO:1903232)",0.967409947907071,0.968001691020313,0.0180876952824091,0.984766788169707
"Melanosome Localization (GO:0032400)",0.973867745292806,0.971204580318135,0.0110962209466723,0.989670376018418
"Melanosome Organization (GO:0032438)",0.980778060276462,0.981179675496777,0.00555458830609676,0.990817904042092
"Melanosome Transport (GO:0032402)",0.976886149412105,0.977754095171745,0.0108807716519498,0.991012103908232
"Membrane Assembly (GO:0071709)",0.993264019080954,0.993904457924124,0.00240858484830215,0.997114650277963
"Membrane Fission (GO:0090148)",0.986228208843722,0.986573279632711,0.00332536762252705,0.994646310841339
"Membrane Fusion (GO:0061025)",0.987837503703578,0.988092041848917,0.00266691722393113,0.994477420476547
"Membrane Lipid Biosynthetic Process (GO:0046467)",0.98315582566994,0.981772942608004,0.00815472330794387,0.990389966272982
"Membrane Lipid Metabolic Process (GO:0006643)",0.989050295954812,0.990044346956586,0.00788126263834678,0.993628016932842
"Membrane Protein Ectodomain Proteolysis (GO:0006509)",0.989688654538635,0.992043382585711,0.00672096469242506,0.99488581755672
"Membrane Protein Intracellular Domain Proteolysis (GO:0031293)",0.979567207504046,0.984103234330055,0.0144772990491109,0.992780865236476
"Membrane Protein Proteolysis (GO:0033619)",0.984249263025077,0.986899801013886,0.0057314702172576,0.992632542765642
"Memory (GO:0007613)",0.979113095111648,0.979429953260508,0.00806121062111086,0.987726418834224
"Mesenchymal Cell Differentiation (GO:0048762)",0.99379231433805,0.993836798972356,0.00137579961588511,0.996057183017513
"Mesenchymal Cell Migration (GO:0090497)",0.961460381971296,0.964257135113281,0.0294262966349842,0.974684792038879
"Mesenchyme Morphogenesis (GO:0072132)",0.965181448799265,0.967080627065913,0.0206578110003007,0.979781227455504
"Mesoderm Development (GO:0007498)",0.992484304463267,0.995139272337136,0.00680551681385701,0.995023663265586
"Mesoderm Formation (GO:0001707)",0.993113949357047,0.996295232971676,0.00960978959973591,0.995186706598455
"Metal Ion Transport (GO:0030001)",0.997770875364667,0.998100885913098,0.000929650300443879,0.99838459618953
"Metallo-Sulfur Cluster Assembly (GO:0031163)",0.992107139075501,0.992900695773082,0.00360566429608173,0.996590298740522
"Metaphase Plate Congression (GO:0051310)",0.98875279217757,0.988797155965354,0.00383815068843282,0.994623259078384
"Methylguanosine-Cap Decapping (GO:0110156)",0.982101144664454,0.983402043900388,0.00858053038361825,0.991853139505302
"miRNA Processing (GO:0035196)",0.996677593410795,0.996699179796661,0.00182325463422345,0.997938195693337
"miRNA-mediated Gene Silencing (GO:0035195)",0.996039537406401,0.995875870899469,0.00161256378583784,0.997817257240701
"miRNA-mediated Gene Silencing By Inhibition Of Translation (GO:0035278)",0.99686219007099,0.997024898841458,0.00129291838940383,0.998274739576976
"Microglial Cell Activation (GO:0001774)",0.975702068097256,0.982085143650925,0.0135993452109535,0.985993644418563
"Microtubule Anchoring At Microtubule Organizing Center (GO:0072393)",0.911782263306847,0.920822256144919,0.0240070117377186,0.971040299152035
"Microtubule Bundle Formation (GO:0001578)",0.98654663381197,0.985358533623875,0.00449631858988795,0.991542114914191
"Microtubule Cytoskeleton Organization Involved In Mitosis (GO:1902850)",0.992182306636323,0.993091016745227,0.00241605065682997,0.995400692680394
"Microtubule Nucleation (GO:0007020)",0.982063522715248,0.982537624429379,0.00579288031850126,0.99104182307706
"Microtubule Polymerization (GO:0046785)",0.987807642583468,0.988149818258029,0.00487389064421906,0.993810151831511
"Microtubule Polymerization Or Depolymerization (GO:0031109)",0.987127092174587,0.994578601385976,0.0131312400337131,0.994288851591333
"Microvillus Assembly (GO:0030033)",0.996866188390958,0.997230387705087,0.00198249588965622,0.998255918876186
"Microvillus Organization (GO:0032528)",0.996632603230619,0.997016986882839,0.00221828820061634,0.997958135073923
"Midbody Abscission (GO:0061952)",0.979445269028905,0.979797301143577,0.00730391635116912,0.995307630283717
"Mismatch Repair (GO:0006298)",0.987591865422484,0.988411092438389,0.00531116441558632,0.994469817655048
"Mitochondrial ATP Synthesis Coupled Electron Transport (GO:0042775)",0.99139821726646,0.99138708177691,0.00173931999661598,0.998539142369309
"Mitochondrial DNA Metabolic Process (GO:0032042)",0.992866218477368,0.994183332150236,0.00561778572747324,0.996151499897923
"Mitochondrial RNA Metabolic Process (GO:0000959)",0.900860771022375,0.90997684611513,0.0381618247370392,0.980642933713933
"Mitochondrial Calcium Ion Homeostasis (GO:0051560)",0.994192034632291,0.994396447310382,0.00304846091339355,0.99691470557091
"Mitochondrial Calcium Ion Transmembrane Transport (GO:0006851)",0.995224771242049,0.995797009224455,0.00268486530433243,0.997627102865385
"Mitochondrial Cytochrome C Oxidase Assembly (GO:0033617)",0.977529502131814,0.981084146348466,0.0119323297905396,0.995016072426164
"Mitochondrial Electron Transport, NADH To Ubiquinone (GO:0006120)",0.987991491885707,0.987579339194612,0.00283964627161423,0.997969737035698
"Mitochondrial Electron Transport, Cytochrome C To Oxygen (GO:0006123)",0.995793406261672,0.995834302539419,0.00161034564863946,0.99940059142231
"Mitochondrial Fission (GO:0000266)",0.975029103976906,0.971929750905198,0.0138669179923058,0.989845170491709
"Mitochondrial Fusion (GO:0008053)",0.992554240085202,0.992783358855448,0.00284513910990199,0.995867323523758
"Mitochondrial Gene Expression (GO:0140053)",0.972666092768455,0.973135942297935,0.00536184398420323,0.994153288068643
"Mitochondrial Genome Maintenance (GO:0000002)",0.965776174491637,0.973046766538213,0.0250375266282362,0.987454002141362
"Mitochondrial Membrane Organization (GO:0007006)",0.989471039466274,0.989793221919627,0.00367849924628963,0.994796026709544
"Mitochondrial Respiratory Chain Complex I Assembly (GO:0032981)",0.989188074892511,0.988458922951951,0.00213678105631098,0.99739538396019
"Mitochondrial Respiratory Chain Complex Assembly (GO:0033108)",0.988247467919414,0.988468861117751,0.00256569294819864,0.996822268244308
"Mitochondrial Translation (GO:0032543)",0.973613804686359,0.973012578305335,0.00547982153249902,0.994470648361889
"Mitochondrial Transport (GO:0006839)",0.990812513709245,0.990764876130177,0.00167592563491415,0.996030149988334
"Mitochondrion Disassembly (GO:0061726)",0.98984580630058,0.990383028786437,0.00193400768620514,0.995786162670839
"Mitochondrion Distribution (GO:0048311)",0.92599410582772,0.92690652092323,0.0250191921355259,0.963460336726353
"Mitochondrion Transport Along Microtubule (GO:0047497)",0.996749216249499,0.996910244247412,0.00133352706182253,0.99814867672151
"Mitophagy (GO:0000423)",0.990695509942783,0.991140485371388,0.00469941739810741,0.995444691019154
"Mitotic DNA Damage Checkpoint Signaling (GO:0044773)",0.98337942533601,0.983070285832774,0.00181002606317859,0.990683591704111
"Mitotic DNA Integrity Checkpoint Signaling (GO:0044774)",0.981349675843311,0.983310666705507,0.0102949784265594,0.99099020874492
"Mitotic DNA Replication (GO:1902969)",0.985068555175341,0.990898053262512,0.00991007824980191,0.991132633701453
"Mitotic G1 DNA Damage Checkpoint Signaling (GO:0031571)",0.998453918094127,0.99837893427337,0.00060712769085151,0.998947093579355
"Mitotic G1/S Transition Checkpoint Signaling (GO:0044819)",0.993129149426529,0.994761358856939,0.00378333141049232,0.996583383154397
"Mitotic G2 DNA Damage Checkpoint Signaling (GO:0007095)",0.974146216935206,0.974406163820357,0.00693029295260143,0.987883904769873
"Mitotic G2/M Transition Checkpoint (GO:0044818)",0.970305943923732,0.968883358217637,0.00805243987639969,0.987061832770638
"Mitotic Cell Cycle Checkpoint Signaling (GO:0007093)",0.969210663605985,0.968236622743996,0.0170911128401044,0.987704431000616
"Mitotic Cell Cycle Phase Transition (GO:0044772)",0.988513930138617,0.989844000272311,0.00400226368149904,0.993537007614338
"Mitotic Chromosome Condensation (GO:0007076)",0.991324613845375,0.992186181664696,0.00483150441358008,0.994634570728517
"Mitotic Cytokinesis (GO:0000281)",0.995295277564475,0.995059016883682,0.00188176412276544,0.997128933610396
"Mitotic Cytokinetic Process (GO:1902410)",0.988613950996588,0.98829397722836,0.00381864391275703,0.996405780460025
"Mitotic intra-S DNA Damage Checkpoint Signaling (GO:0031573)",0.953036617518385,0.957673317943821,0.021801581804206,0.974287435875497
"Mitotic Metaphase Plate Congression (GO:0007080)",0.987620981824256,0.986879643420401,0.00376093753037692,0.994540469519489
"Mitotic Nuclear Division (GO:0140014)",0.995663414973825,0.995633961699928,0.00135851391214667,0.997304342921879
"Mitotic Recombination (GO:0006312)",0.940438243533579,0.938504987015235,0.0302696795567421,0.978188045806108
"Mitotic Sister Chromatid Cohesion (GO:0007064)",0.963867194203412,0.966845669228917,0.0119326067860141,0.987303932665034
"Mitotic Sister Chromatid Segregation (GO:0000070)",0.990710699849524,0.990921737792752,0.00202546645441274,0.995178967847991
"Mitotic Spindle Assembly (GO:0090307)",0.988335750207472,0.989022702868873,0.00405771929654245,0.993730529431943
"Mitotic Spindle Assembly Checkpoint Signaling (GO:0007094)",0.992959472339506,0.993870254940761,0.00377082724620199,0.996230419785611
"Mitotic Spindle Checkpoint Signaling (GO:0071174)",0.992959472339506,0.993870254940761,0.00377082724620199,0.996230419785611
"Mitotic Spindle Organization (GO:0007052)",0.990399931436073,0.990916566985087,0.00206870547979401,0.994784348238702
"Modified Amino Acid Transport (GO:0072337)",0.847267315366254,0.893136749093307,0.129447122869475,0.934966852427218
"Modulation By Host Of Symbiont Process (GO:0051851)",0.97738393419915,0.980469486858098,0.00894086166371947,0.990976883762137
"Modulation By Host Of Viral Genome Replication (GO:0044827)",0.997990142038988,0.997971988673962,0.000770779844626591,0.998784018879456
"Modulation By Host Of Viral Process (GO:0044788)",0.997277368282347,0.997030529992013,0.000931003403503851,0.998317556483479
"Modulation By Symbiont Of Entry Into Host (GO:0052372)",0.94530692222497,0.960474277860565,0.0345661329961031,0.974209837789792
