"Pathway","R2mean","R2median","R2sd","V1VE"
"Import Into Cell (GO:0098657)",0.991775547791574,0.992058249135422,0.00393286941961971,0.995151032652133
"Import Into Nucleus (GO:0051170)",0.998008326725096,0.998129334220352,0.000381808449764924,0.998886042922337
"In Utero Embryonic Development (GO:0001701)",0.990070791994871,0.99075192474851,0.00567030259318384,0.994972605609023
"Innate Immune Response Activating Cell Surface Receptor Signaling Pathway (GO:0002220)",0.999602001200748,0.999642422636286,0.000196480234466188,0.999751159329519
"Innate Immune Response-Activating Signaling Pathway (GO:0002758)",0.998815871168803,0.99898936463501,0.000524657908472581,0.999456385531856
"Inner Mitochondrial Membrane Organization (GO:0007007)",0.998225062347012,0.998150035284056,0.000480643150067179,0.998986499598841
"Inorganic Anion Transmembrane Transport (GO:0098661)",0.998311379820786,0.998573446198746,0.000708591405743478,0.998806632920673
"Inorganic Anion Transport (GO:0015698)",0.999533926206946,0.999538203025872,0.000134062704161359,0.999673528660834
"Inorganic Cation Import Across Plasma Membrane (GO:0098659)",0.998877202695755,0.998916850881697,0.000276660400867179,0.999236262290378
"Inositol Lipid-Mediated Signaling (GO:0048017)",0.994663422221326,0.994354404115165,0.00153812430837354,0.996882778170425
"Inositol Phosphate Metabolic Process (GO:0043647)",0.990668913581191,0.990718870284698,0.00342479964511588,0.994379441042167
"Inositol Phosphate-Mediated Signaling (GO:0048016)",0.938110888513784,0.935084857914129,0.0290599207760623,0.98250428858497
"Insulin Receptor Signaling Pathway (GO:0008286)",0.998722218288343,0.99872712544086,0.000400778269618086,0.999154457784848
"Insulin Secretion (GO:0030073)",0.999871987887912,0.999886712893763,8.51122635998333e-05,0.999913968189363
"Integrated Stress Response Signaling (GO:0140467)",0.999406459113459,0.999445625640101,0.000191600437295135,0.999669127802164
"Integrin-Mediated Signaling Pathway (GO:0007229)",0.998021849191144,0.998143092423405,0.000570588662009949,0.998908042942692
"Interferon-Mediated Signaling Pathway (GO:0140888)",0.997188784871771,0.997522100659262,0.00129691102551967,0.998864859895013
"Interleukin-1-Mediated Signaling Pathway (GO:0070498)",0.999060585081494,0.999235505677472,0.000436676007116577,0.999426696768097
"Interleukin-15-Mediated Signaling Pathway (GO:0035723)",0.998457776500574,0.998344640686314,0.000883931271569891,0.999132203510357
"Interleukin-6-Mediated Signaling Pathway (GO:0070102)",0.999386158394267,0.999371222339442,0.000280779468361487,0.999653317354423
"Intermediate Filament Organization (GO:0045109)",0.999879113341419,0.999912726462731,9.63911857816113e-05,0.999913647472987
"Internal Peptidyl-Lysine Acetylation (GO:0018393)",0.996820134828995,0.996800848615725,0.00100910764181722,0.99835190900341
"Interstrand Cross-Link Repair (GO:0036297)",0.996439936258136,0.996703185807437,0.00167615041672529,0.997434670983929
"intra-Golgi Vesicle-Mediated Transport (GO:0006891)",0.998610696640611,0.998650683353018,0.000374500098585287,0.999274156405581
"Intracellular Calcium Ion Homeostasis (GO:0006874)",0.998580339963693,0.99863227910891,0.000497228224220294,0.99907413277767
"Intracellular Cholesterol Transport (GO:0032367)",0.99990037533089,0.999902947276337,4.24407750993163e-05,0.999925465764058
"Intracellular Estrogen Receptor Signaling Pathway (GO:0030520)",0.998971237468952,0.998978723019577,0.000391965639559704,0.999489496544323
"Intracellular Glucose Homeostasis (GO:0001678)",0.996169526502198,0.997049989691653,0.00232422920483133,0.99773889292716
"Intracellular Iron Ion Homeostasis (GO:0006879)",0.999922590323435,0.999922160600466,1.87655471821281e-05,0.999947252817089
"Intracellular Lipid Transport (GO:0032365)",0.999789168842844,0.99978012646528,0.000100094625927022,0.999839835064956
"Intracellular Monoatomic Ion Homeostasis (GO:0006873)",0.999314790976668,0.999270551498598,0.000351915625402395,0.999462241943702
"Intracellular pH Reduction (GO:0051452)",0.999578915416185,0.99962895841053,0.000123183746244822,0.999772567041904
"Intracellular Protein Transmembrane Transport (GO:0065002)",0.998830654601789,0.998836549393088,0.000237309026431766,0.99932147764246
"Intracellular Steroid Hormone Receptor Signaling Pathway (GO:0030518)",0.997713308496713,0.997796310373428,0.00066477989261435,0.998844611035579
"Intracellular Sterol Transport (GO:0032366)",0.99989777726386,0.999885584855354,3.3307778012652e-05,0.999922718974765
"Intracellular Zinc Ion Homeostasis (GO:0006882)",0.998177301629492,0.998446722101243,0.00115823064570559,0.998946294344104
"Intraciliary Anterograde Transport (GO:0035720)",0.992948203937429,0.993824745494383,0.0034302039808474,0.996064976913373
"Intraciliary Retrograde Transport (GO:0035721)",0.999893513362583,0.999904865944396,8.60299143193965e-05,0.999916033363915
"Intrinsic Apoptotic Signaling Pathway (GO:0097193)",0.998830394091816,0.998906017921582,0.000308616093843062,0.999332526809902
"Intrinsic Apoptotic Signaling Pathway By P53 Class Mediator (GO:0072332)",0.998445601333783,0.998530439203676,0.000593402940783196,0.999080626812854
"Intrinsic Apoptotic Signaling Pathway In Response To DNA Damage (GO:0008630)",0.99745299970175,0.997396466343976,0.000638375716832004,0.998584828790243
"Intrinsic Apoptotic Signaling Pathway In Response To DNA Damage By P53 Class Mediator (GO:0042771)",0.996787395123243,0.996541465319809,0.00145458234066929,0.998470516261705
"Intrinsic Apoptotic Signaling Pathway In Response To Endoplasmic Reticulum Stress (GO:0070059)",0.99955556642581,0.999614071867257,0.000268690747929989,0.999739047734205
"Intrinsic Apoptotic Signaling Pathway In Response To Oxidative Stress (GO:0008631)",0.99872494531625,0.998770733781276,0.000506276419140829,0.999351884223982
"Iron Ion Transport (GO:0006826)",0.999955627087049,0.999967076499606,3.73758654509894e-05,0.999967115612963
"Iron-Sulfur Cluster Assembly (GO:0016226)",0.997100408014311,0.997056363425016,0.00132863420840238,0.998535965524153
"Isotype Switching (GO:0045190)",0.997901057379444,0.998770450525155,0.0026700647821461,0.998759130396714
"Keratan Sulfate Biosynthetic Process (GO:0018146)",0.995578986156597,0.996619884842288,0.00269367045241808,0.997568733256103
"Keratan Sulfate Metabolic Process (GO:0042339)",0.991970415429559,0.993868850307592,0.0053431820916199,0.996195579857667
"Keratinocyte Differentiation (GO:0030216)",0.999462277302353,0.999486702278719,0.000137850692808485,0.999660346574748
"Kidney Development (GO:0001822)",0.997107893934761,0.997175529542437,0.000940420501671235,0.9982256620898
"Lamellipodium Assembly (GO:0030032)",0.999559060488844,0.99967861724874,0.000355972305342828,0.999680226490707
"Lamellipodium Organization (GO:0097581)",0.99931730163096,0.999468969169918,0.000300306976173196,0.99955282554529
"Late Endosome To Lysosome Transport (GO:1902774)",0.997397924075432,0.997409353584053,0.000949457313486936,0.999130951692288
"Late Endosome To Vacuole Transport (GO:0045324)",0.997597105559717,0.997539054331302,0.000658694723586615,0.999277225203039
"Late Endosome To Vacuole Transport Via Multivesicular Body Sorting Pathway (GO:0032511)",0.997696105840099,0.998152987661401,0.00110874417169828,0.999118538299273
"Learning (GO:0007612)",0.998892511424107,0.998842417705495,0.000385243976802319,0.99925878702292
"Left/Right Pattern Formation (GO:0060972)",0.996942319115212,0.997695302989638,0.00177482047659078,0.998179460252442
"Leukocyte Adhesion To Vascular Endothelial Cell (GO:0061756)",0.99743473160487,0.997841959622656,0.00141765563723518,0.998463351250765
"Leukocyte Cell-Cell Adhesion (GO:0007159)",0.997662007017722,0.99819559384884,0.00165636474416092,0.998891799390007
"Leukocyte Tethering Or Rolling (GO:0050901)",0.994886285336665,0.99531749522245,0.00300187535717503,0.997091171151597
"Leukotriene Metabolic Process (GO:0006691)",0.997441089792726,0.998511928477669,0.00208369792041746,0.998642468858728
"Limb Development (GO:0060173)",0.913211835113894,0.937268755294133,0.0542176508648426,0.959465980763244
"Limb Morphogenesis (GO:0035108)",0.996120013813092,0.996585949261969,0.00196409832858699,0.997846340489252
"Linoleic Acid Metabolic Process (GO:0043651)",0.999619490706803,0.999642284475169,0.000163980327952324,0.99976194653046
"Lipid Biosynthetic Process (GO:0008610)",0.997458443888507,0.997604928487303,0.00143278213851439,0.99835747573185
"Lipid Droplet Formation (GO:0140042)",0.998392434081779,0.998853689527691,0.00191042279351437,0.998903433176922
"Lipid Droplet Organization (GO:0034389)",0.998413782025308,0.99862056380542,0.000879721775340098,0.999152290782586
"Lipid Modification (GO:0030258)",0.999700679548645,0.999714860358897,0.000126605982058087,0.99978366404323
"Lipid Translocation (GO:0034204)",0.986129438870362,0.986834365552711,0.00624836103012213,0.992004739855128
"Lipid Transport (GO:0006869)",0.99880646237985,0.998978943497207,0.0005946098063918,0.999204739971793
"Lipopolysaccharide-Mediated Signaling Pathway (GO:0031663)",0.999243050553845,0.999274629314737,0.00038343202124784,0.999587146572204
"Lipoprotein Biosynthetic Process (GO:0042158)",0.976918800978388,0.979418187430225,0.013304132101397,0.99249863928879
"Lipoprotein Localization (GO:0044872)",0.995184317008086,0.995224784053828,0.00226363279402736,0.99842406547602
"Lipoprotein Transport (GO:0042953)",0.995596359919949,0.995683622154116,0.00219385253963863,0.998513576101392
"Liver Development (GO:0001889)",0.999309123241616,0.999344689994686,0.000175792709896389,0.999523674234709
"Long-Chain Fatty Acid Biosynthetic Process (GO:0042759)",0.999900560412561,0.999916654625687,7.36416416188645e-05,0.999932462958671
"Long-Chain Fatty Acid Metabolic Process (GO:0001676)",0.999392372721945,0.99941682049154,0.000108713428274901,0.999585242907534
"Long-Chain Fatty Acid Transport (GO:0015909)",0.994701565688683,0.994346540374212,0.00337902591441421,0.996780876189306
"Long-Chain fatty-acyl-CoA Biosynthetic Process (GO:0035338)",0.993000817348879,0.992760126239052,0.00218835512234212,0.996699057184618
"Long-Chain fatty-acyl-CoA Metabolic Process (GO:0035336)",0.992451032884548,0.992388148554723,0.00116595691602616,0.996276253401451
"Long-Term Memory (GO:0007616)",0.997608430340522,0.9982094346695,0.00144435386997719,0.998625823576736
"Long-Term Synaptic Potentiation (GO:0060291)",0.997814272673593,0.998141487534197,0.00141786779914951,0.998655152952099
"Lung Development (GO:0030324)",0.986966841873229,0.990521053321366,0.0093713088753807,0.99384558610058
"Lymphocyte Activation Involved In Immune Response (GO:0002285)",0.999875790124605,0.99988394938757,6.65178243273417e-05,0.999920471370415
"Lymphocyte Chemotaxis (GO:0048247)",0.997883737737872,0.998521962730763,0.00187434568682507,0.998643843445095
"Lymphocyte Differentiation (GO:0030098)",0.997688034857903,0.997894788099334,0.000691984243281422,0.998549411589279
"Lymphocyte Mediated Immunity (GO:0002449)",0.993787571922213,0.993466637702738,0.00332576855526884,0.995875063903028
"Lymphocyte Migration (GO:0072676)",0.998862906429289,0.998683572959148,0.000447123826937841,0.999248803489739
"Lymphocyte Proliferation (GO:0046651)",0.998613915974898,0.998828867710623,0.00060379041468474,0.999116244091732
"Lysosomal Lumen Acidification (GO:0007042)",0.999590729779172,0.999684768385251,0.000212265756844196,0.999792138464125
"Lysosomal Membrane Organization (GO:0097212)",0.997493744063266,0.997652119381363,0.00105705992432793,0.999259754787643
"Lysosomal Microautophagy (GO:0016237)",0.994902062589601,0.99630231311893,0.00436223828947493,0.997235217016717
"Lysosomal Transport (GO:0007041)",0.999078472848874,0.999140555600274,0.000287525792257332,0.999448887180411
"Lysosome Localization (GO:0032418)",0.998353549786474,0.99837899785511,0.00043601735668901,0.999119220662125
"Lysosome Organization (GO:0007040)",0.998693030783603,0.998932157081103,0.000485533751655881,0.999226511290139
"Lytic Vacuole Organization (GO:0080171)",0.998858176169492,0.999123923336076,0.000511822759264933,0.99928697971872
"mRNA 3'-End Processing (GO:0031124)",0.999039655822836,0.999046664496408,0.000231945662214387,0.999402213086016
"mRNA Catabolic Process (GO:0006402)",0.998148013617626,0.998204913521834,0.000670499696954264,0.998993906607269
"mRNA Cis Splicing, Via Spliceosome (GO:0045292)",0.991873952773428,0.993242093618406,0.00593684406601142,0.996835181189126
"mRNA Cleavage Involved In mRNA Processing (GO:0098787)",0.983106719168917,0.984312373160424,0.00826023306638295,0.995037199181826
"mRNA Destabilization (GO:0061157)",0.99738506301273,0.997287882297073,0.00068614595956441,0.998468623087348
"mRNA Export From Nucleus (GO:0006406)",0.99829843641446,0.998263452831646,0.00044436186694816,0.99911016512134
"mRNA Metabolic Process (GO:0016071)",0.998419301832163,0.998473359263165,0.000265608143765082,0.999257852413761
"mRNA Methylation (GO:0080009)",0.998764580270991,0.998839106961775,0.000526212564443732,0.999140498657465
"mRNA Modification (GO:0016556)",0.997820792959993,0.997695279786694,0.000886381697960864,0.998489954644332
"mRNA Polyadenylation (GO:0006378)",0.999347922716191,0.999367785032488,0.000290583219389036,0.999587175973456
"mRNA Splice Site Recognition (GO:0006376)",0.996974241109543,0.997100592788933,0.000797337930988941,0.998741370542565
"mRNA Stabilization (GO:0048255)",0.999251658120416,0.999279031892804,0.000152921695216966,0.999612263841674
"mRNA Transcription (GO:0009299)",0.999449873707328,0.999459637604457,0.000230266144542554,0.999652533038935
"mRNA Transcription By RNA Polymerase II (GO:0042789)",0.999442692903114,0.999475583001544,0.000245613910960946,0.999635971301986
"mRNA Transport (GO:0051028)",0.998686724364867,0.998756745388677,0.000474487320071987,0.999301102925625
"Macroautophagy (GO:0016236)",0.998022489078433,0.998072204292504,0.000494829145817128,0.999060665493828
"Macromolecule Catabolic Process (GO:0009057)",0.997830336795912,0.99776456053326,0.000536721371631287,0.998771598046066
"Macromolecule Modification (GO:0043412)",0.999042370603236,0.999099286827852,0.000197966413898585,0.999419475377376
"Macrophage Activation (GO:0042116)",0.998974565357035,0.998923182085166,0.000314216349890996,0.999448395468846
"Macrophage Activation Involved In Immune Response (GO:0002281)",0.999857741847646,0.999864850754778,5.06738731704797e-05,0.999910122221409
"Macrophage Differentiation (GO:0030225)",0.999424579500338,0.999568727800963,0.000450449685488484,0.999616175313232
"Maintenance Of Blood-Brain Barrier (GO:0035633)",0.999897856810962,0.99993525366833,0.000107978524989247,0.999920185887195
"Maintenance Of Protein Localization In Organelle (GO:0072595)",0.999329946716904,0.999376685872143,0.000250707271723749,0.999632487741814
"Maintenance Of Protein Location In Nucleus (GO:0051457)",0.999272136999798,0.99925158918314,0.000127915025892039,0.999585975868028
"Male Gonad Development (GO:0008584)",0.997713535259916,0.997999508078402,0.000906675526399656,0.998605960220316
"Maturation Of 5.8S rRNA (GO:0000460)",0.998504274431643,0.998625723524192,0.000954688010290481,0.99899631721368
"Maturation Of 5.8S rRNA From Tricistronic rRNA Transcript (SSU-rRNA, 5.8S rRNA, LSU-rRNA) (GO:0000466)",0.998236338819748,0.99836200272098,0.000738386279886888,0.998836277433018
"Maturation Of LSU-rRNA (GO:0000470)",0.999709046509233,0.99973828289978,0.000156610114810173,0.999801987766409
"Maturation Of LSU-rRNA From Tricistronic rRNA Transcript (SSU-rRNA, 5.8S rRNA, LSU-rRNA) (GO:0000463)",0.999788586710163,0.999799333068475,0.000114953620381318,0.999851009800211
"Maturation Of SSU-rRNA (GO:0030490)",0.999832152017399,0.999826120532224,3.91168388362019e-05,0.999891955251634
"Maturation Of SSU-rRNA From Tricistronic rRNA Transcript (SSU-rRNA, 5.8S rRNA, LSU-rRNA) (GO:0000462)",0.999882156177439,0.999887330023823,3.27684221277311e-05,0.999923422076402
"Mature B Cell Differentiation Involved In Immune Response (GO:0002313)",0.99827410964371,0.998254470669593,0.000719890352956443,0.998981274177164
"Megakaryocyte Differentiation (GO:0030219)",0.999316351945585,0.999321026641979,0.000292211787648698,0.999496323211909
"Meiosis I (GO:0007127)",0.990680493035696,0.991262109705703,0.00502390676401943,0.994617222190419
"Melanosome Assembly (GO:1903232)",0.998750808075349,0.998793820805938,0.000662709230170833,0.99929212221392
"Melanosome Localization (GO:0032400)",0.99655471191667,0.997748774161136,0.00285996191210784,0.998377454937986
"Melanosome Organization (GO:0032438)",0.998047037626355,0.998174708754773,0.000818006962993139,0.998957766152559
"Melanosome Transport (GO:0032402)",0.996476967739377,0.997934455386237,0.00312521513212461,0.998448284290004
"Membrane Assembly (GO:0071709)",0.999616051446792,0.999662204351638,0.000127713707594547,0.99977769300225
"Membrane Fission (GO:0090148)",0.997474301742302,0.997401932821677,0.000979387604191064,0.998994775172959
"Membrane Fusion (GO:0061025)",0.996578482140979,0.996336894007842,0.00103105776853969,0.998735108650901
"Membrane Lipid Biosynthetic Process (GO:0046467)",0.996518530865715,0.996881808911377,0.00106026536528778,0.998099242357442
"Membrane Lipid Metabolic Process (GO:0006643)",0.999539590417905,0.999546507234936,0.000221788298954566,0.999701365460247
"Membrane Protein Ectodomain Proteolysis (GO:0006509)",0.998549848564188,0.998416495118975,0.000415418450245813,0.999326130250097
"Membrane Protein Intracellular Domain Proteolysis (GO:0031293)",0.998924087413782,0.99908257538659,0.000489980831478853,0.999530795743713
"Membrane Protein Proteolysis (GO:0033619)",0.998355437761526,0.998266642975642,0.000358117790544673,0.999197283091107
"Memory (GO:0007613)",0.996627303991896,0.99672789669488,0.00213210986808609,0.997849742489682
"Mesenchymal Cell Differentiation (GO:0048762)",0.999617505559377,0.999648002904624,0.000106928472498674,0.999737183424189
"Mesenchymal Cell Migration (GO:0090497)",0.997971478435062,0.998126832940986,0.00113019358128731,0.998818922648067
"Mesenchyme Morphogenesis (GO:0072132)",0.999305887974395,0.999384702132677,0.000315213980012829,0.999529178329313
"Mesoderm Development (GO:0007498)",0.998503826385181,0.99893472897003,0.00121928851060003,0.998999695826608
"Mesoderm Formation (GO:0001707)",0.996816747266319,0.996695880323647,0.00158560050771946,0.998154219138458
"Metal Ion Transport (GO:0030001)",0.998881311788473,0.999148686291899,0.000523518142824612,0.999240801888376
"Metallo-Sulfur Cluster Assembly (GO:0031163)",0.997100408014311,0.997056363425016,0.00132863420840238,0.998535965524153
"Metaphase Plate Congression (GO:0051310)",0.997234777262427,0.997338279209186,0.000772586750815105,0.99860505017739
"Methylguanosine-Cap Decapping (GO:0110156)",0.99591001728935,0.995926241395081,0.00207675139944788,0.997741179856025
"miRNA Processing (GO:0035196)",0.999316097905481,0.999402465027663,0.000392919046819768,0.999556587538971
"miRNA-mediated Gene Silencing (GO:0035195)",0.999162991415447,0.999184715767959,0.000237768238168803,0.999527239533727
"miRNA-mediated Gene Silencing By Inhibition Of Translation (GO:0035278)",0.999321422700438,0.99946618838618,0.000443278929873087,0.999637252541622
"Microglial Cell Activation (GO:0001774)",0.999800027364176,0.99980270813004,7.83276605893101e-05,0.999885087111225
"Microtubule Anchoring At Microtubule Organizing Center (GO:0072393)",0.991419025890821,0.993722828881903,0.00561727300475388,0.995870873533682
"Microtubule Bundle Formation (GO:0001578)",0.992347162296192,0.992844715366217,0.00349598014438692,0.995450103124047
"Microtubule Cytoskeleton Organization Involved In Mitosis (GO:1902850)",0.996851708913769,0.997242759858451,0.00155297327439288,0.998086105000652
"Microtubule Nucleation (GO:0007020)",0.995632610726917,0.995376201254492,0.00240018122036114,0.997446806944921
"Microtubule Polymerization (GO:0046785)",0.995878482592291,0.996321581369669,0.00259812556056235,0.997682256270147
"Microtubule Polymerization Or Depolymerization (GO:0031109)",0.996485556705738,0.997024141054252,0.00306264876393474,0.99800007337637
"Microvillus Assembly (GO:0030033)",0.999266480665639,0.999253568450769,0.000204187414045691,0.99960053312742
"Microvillus Organization (GO:0032528)",0.999341643308158,0.999388237266174,0.000188173982257203,0.999622773525187
"Midbody Abscission (GO:0061952)",0.996598074886989,0.996474282577349,0.00113278691598196,0.999123756513261
"Mismatch Repair (GO:0006298)",0.991251411151936,0.993103771117336,0.00503618244889159,0.995546368120671
"Mitochondrial ATP Synthesis Coupled Electron Transport (GO:0042775)",0.997853251398712,0.998025856763825,0.000540539992874828,0.999553646217528
"Mitochondrial DNA Metabolic Process (GO:0032042)",0.998437915606263,0.998826945919014,0.001058579729475,0.998845597063711
"Mitochondrial RNA Metabolic Process (GO:0000959)",0.977320084494417,0.976462985807575,0.00961746615305909,0.992432656303885
"Mitochondrial Calcium Ion Homeostasis (GO:0051560)",0.998608369423709,0.998586672873693,0.000615089963555106,0.999211580975443
"Mitochondrial Calcium Ion Transmembrane Transport (GO:0006851)",0.999201289344935,0.99926793260092,0.00040877849721899,0.999558089272972
"Mitochondrial Cytochrome C Oxidase Assembly (GO:0033617)",0.991601071696272,0.993188147492023,0.00377911938009588,0.997358237310782
"Mitochondrial Electron Transport, NADH To Ubiquinone (GO:0006120)",0.995699972691909,0.995918709550007,0.00122143290708658,0.999089024241684
"Mitochondrial Electron Transport, Cytochrome C To Oxygen (GO:0006123)",0.998916814432353,0.998928957770113,0.000465383327988823,0.99985447765275
"Mitochondrial Fission (GO:0000266)",0.996640329802612,0.997654829772114,0.00272269963143726,0.998015425881716
"Mitochondrial Fusion (GO:0008053)",0.995783558107101,0.995257653074707,0.0015388017068635,0.997769229465088
"Mitochondrial Gene Expression (GO:0140053)",0.993830545977592,0.993967272403949,0.000537524593172949,0.997657533607543
"Mitochondrial Genome Maintenance (GO:0000002)",0.99971026184979,0.999801052009112,0.00020456495284048,0.999789054503398
"Mitochondrial Membrane Organization (GO:0007006)",0.998911047531153,0.998885672189185,0.000337853446116128,0.999334405767018
"Mitochondrial Respiratory Chain Complex I Assembly (GO:0032981)",0.997218965161643,0.997461841391341,0.000639955169177674,0.999077514426146
"Mitochondrial Respiratory Chain Complex Assembly (GO:0033108)",0.996962960617057,0.996950242115192,0.000622529751520969,0.998856630618261
"Mitochondrial Translation (GO:0032543)",0.994310754078031,0.994506315073845,0.00053678303561088,0.997837054995982
"Mitochondrial Transport (GO:0006839)",0.998920935705432,0.998935778355272,0.000322311367241079,0.999395963248769
"Mitochondrion Disassembly (GO:0061726)",0.99865933787649,0.998735020186104,0.000517889943065363,0.999334655602483
"Mitochondrion Distribution (GO:0048311)",0.993920400706838,0.994581401951542,0.00392252136995857,0.996614060648653
"Mitochondrion Transport Along Microtubule (GO:0047497)",0.999443037594884,0.999547532651869,0.00031969434019065,0.999685113657269
"Mitophagy (GO:0000423)",0.999498739287108,0.999576121198599,0.00025410488694275,0.999669566167681
"Mitotic DNA Damage Checkpoint Signaling (GO:0044773)",0.99701690700451,0.996968966822699,0.000864244393344943,0.998161653529778
"Mitotic DNA Integrity Checkpoint Signaling (GO:0044774)",0.988452236185951,0.99181779647206,0.00935379526519623,0.994780304225277
"Mitotic DNA Replication (GO:1902969)",0.928525880301315,0.941881368067617,0.0566756948991749,0.965383238241572
"Mitotic G1 DNA Damage Checkpoint Signaling (GO:0031571)",0.999669106014195,0.999690009792295,0.000172728686400343,0.999768268677793
"Mitotic G1/S Transition Checkpoint Signaling (GO:0044819)",0.998842432514174,0.998876638222586,0.000383399963710043,0.999324878902227
"Mitotic G2 DNA Damage Checkpoint Signaling (GO:0007095)",0.996283244640963,0.996462265948329,0.00188477510287368,0.997877463099306
"Mitotic G2/M Transition Checkpoint (GO:0044818)",0.99465638751803,0.9951411834568,0.00240211609563251,0.99704761323232
"Mitotic Cell Cycle Checkpoint Signaling (GO:0007093)",0.9853534145103,0.989094104989635,0.00762427342539266,0.994301963793645
"Mitotic Cell Cycle Phase Transition (GO:0044772)",0.997943547697813,0.99801632936395,0.00058656665849122,0.99869116214209
"Mitotic Chromosome Condensation (GO:0007076)",0.990482586419139,0.99193657867421,0.00724471971024456,0.994537543568737
"Mitotic Cytokinesis (GO:0000281)",0.999282555774186,0.999262640731902,0.00028826006362957,0.999517404606538
"Mitotic Cytokinetic Process (GO:1902410)",0.998686630523498,0.998664854837811,0.000405564537212093,0.999490303767658
"Mitotic intra-S DNA Damage Checkpoint Signaling (GO:0031573)",0.98802767138698,0.988732453912046,0.00581847106166895,0.993219976372835
"Mitotic Metaphase Plate Congression (GO:0007080)",0.997309765100166,0.997397286245761,0.000771775444903891,0.99870327568892
"Mitotic Nuclear Division (GO:0140014)",0.998593480713218,0.998482673606106,0.000366771577836669,0.999075982550583
"Mitotic Recombination (GO:0006312)",0.990754833036585,0.992695074788268,0.00796504092917335,0.994870664486631
"Mitotic Sister Chromatid Cohesion (GO:0007064)",0.989064648740604,0.989421926693999,0.00354911536153384,0.996632779115188
"Mitotic Sister Chromatid Segregation (GO:0000070)",0.998403748350983,0.998457846699965,0.000305638551136444,0.999048990459994
"Mitotic Spindle Assembly (GO:0090307)",0.998841755681841,0.998956104529889,0.000506629416745079,0.999244159467352
"Mitotic Spindle Assembly Checkpoint Signaling (GO:0007094)",0.99719699859392,0.997755491765142,0.00129331233610118,0.998403587933995
"Mitotic Spindle Checkpoint Signaling (GO:0071174)",0.99719699859392,0.997755491765142,0.00129331233610118,0.998403587933995
"Mitotic Spindle Organization (GO:0007052)",0.998372943759668,0.998547292724765,0.000501880362604561,0.998999227286885
"Modified Amino Acid Transport (GO:0072337)",0.999285746202452,0.999380327254336,0.000444961883441365,0.999481318670363
