"Pathway","R2mean","R2median","R2sd","V1VE"
"Nucleosome Disassembly (GO:0006337)",0.998309421032166,0.998436190179227,0.000920558975760156,0.998992068763333
"Nucleosome Organization (GO:0034728)",0.997343717950286,0.997341863040831,0.000563375791844254,0.998638517724422
"Nucleotide Biosynthetic Process (GO:0009165)",0.99555399169202,0.996798430818518,0.00317603957522912,0.997419682538519
"Nucleotide Metabolic Process (GO:0009117)",0.999429523265079,0.999541603154906,0.000523098843104827,0.99967610097243
"Nucleotide-Excision Repair (GO:0006289)",0.993956277423462,0.993371026591378,0.0015952242185944,0.996659623458164
"Nucleotide-Sugar Biosynthetic Process (GO:0009226)",0.998737890856927,0.998696509093669,0.000417968376124989,0.999215044360864
"Nucleotide-Sugar Metabolic Process (GO:0009225)",0.998277388661307,0.998257588735846,0.000781437682429338,0.998749439419843
"Nucleus Organization (GO:0006997)",0.999162379726979,0.99920054171543,0.000206413876276427,0.999515785167823
"Odontogenesis (GO:0042476)",0.993021669588999,0.99624706609937,0.00595661973484051,0.99620683189786
"Oligosaccharide Biosynthetic Process (GO:0009312)",0.99025968442697,0.991057954506053,0.0063328875246868,0.994761337068653
"Oligosaccharide Metabolic Process (GO:0009311)",0.994237860780402,0.994423215888471,0.00181832647135609,0.996982707705562
"Oligosaccharide-Lipid Intermediate Biosynthetic Process (GO:0006490)",0.998772949261205,0.998623572396351,0.000380498989676141,0.999202180655605
"One-Carbon Compound Transport (GO:0019755)",0.988049704205175,0.988460810932471,0.0092451663169511,0.993140172884629
"Organelle Disassembly (GO:1903008)",0.997549941897654,0.997390459353195,0.000425951254163997,0.998733873223588
"Organelle Fission (GO:0048285)",0.995815146400747,0.997122993867495,0.00381621492416054,0.997747561565889
"Organelle Fusion (GO:0048284)",0.995325079441327,0.994976030990223,0.0017598743781429,0.997580071199352
"Organelle Membrane Fusion (GO:0090174)",0.995225050952154,0.995308770455449,0.00240938523110362,0.99817458830105
"Organelle Transport Along Microtubule (GO:0072384)",0.999303044475215,0.999352593021501,0.000258820231528383,0.999630190570513
"Organic Anion Transport (GO:0015711)",0.997872209220785,0.997953974859793,0.000707102082080653,0.998718732221528
"Organic Cation Transport (GO:0015695)",0.995717693680883,0.99487472491251,0.00256149448736504,0.997281640108953
"Organic Cyclic Compound Biosynthetic Process (GO:1901362)",0.988045957741263,0.990219967651485,0.00917481742965428,0.993489275165851
"Organic Hydroxy Compound Biosynthetic Process (GO:1901617)",0.99832958059352,0.998279279540507,0.000756259702121725,0.998904367971013
"Organic Hydroxy Compound Transport (GO:0015850)",0.998291637003544,0.99840543490859,0.00053378455838656,0.998849953804483
"Organonitrogen Compound Biosynthetic Process (GO:1901566)",0.99741722431119,0.997375621483311,0.000754550775000915,0.998380720443488
"Organonitrogen Compound Catabolic Process (GO:1901565)",0.998862578775333,0.998859736504769,0.000251740729191875,0.99935988194624
"Organophosphate Biosynthetic Process (GO:0090407)",0.998956667782299,0.999182011192888,0.000682484149892014,0.999253384133978
"Organophosphate Ester Transport (GO:0015748)",0.999599100546063,0.999627896652146,0.000123169891217929,0.999737704872712
"Osteoclast Differentiation (GO:0030316)",0.999585350049766,0.999530383741386,0.000183377163941731,0.999729848983962
"Outer Mitochondrial Membrane Organization (GO:0007008)",0.997979505736968,0.998145549852618,0.00100745074065483,0.999096496355114
"Oxidative Phosphorylation (GO:0006119)",0.996689907159431,0.996944272480238,0.000776556799232452,0.999316512515535
"Oxoacid Metabolic Process (GO:0043436)",0.996226221080106,0.996178891043143,0.0019881985147225,0.997870952527061
"Pattern Recognition Receptor Signaling Pathway (GO:0002221)",0.999336788465023,0.999304764551412,0.000184883583239877,0.999603203777417
"Pentose-Phosphate Shunt (GO:0006098)",0.999475638353374,0.999547627273374,0.000240892787836008,0.999733409726094
"Peptide Antigen Assembly With MHC Class II Protein Complex (GO:0002503)",0.999728084941731,0.999798299432002,0.000201967926567467,0.999845722542874
"Peptide Antigen Assembly With MHC Protein Complex (GO:0002501)",0.999636209674985,0.999723407862742,0.000211160622242868,0.999824160074893
"Peptide Catabolic Process (GO:0043171)",0.997907541017474,0.998215476344132,0.00135290613150915,0.998921587309511
"Peptide Cross-Linking (GO:0018149)",0.999854294465201,0.999850678473847,7.03446173272348e-05,0.999900879288203
"Peptide Hormone Secretion (GO:0030072)",0.999891728347777,0.999911646445314,6.64396749871447e-05,0.999926837090575
"Peptide Metabolic Process (GO:0006518)",0.997562687860991,0.99778803664966,0.000772705041939293,0.998748453009266
"peptidyl-L-cysteine S-palmitoylation (GO:0018230)",0.992655072789716,0.992783848478064,0.00347059983203954,0.996249098823321
"peptidyl-S-diacylglycerol-L-cysteine Biosynthetic Process From Peptidyl-Cysteine (GO:0018231)",0.992655072789716,0.992783848478064,0.00347059983203954,0.996249098823321
"Peptidyl-Glutamic Acid Modification (GO:0018200)",0.996121742071595,0.995959204880293,0.00220810002481551,0.99780479367625
"Peptidyl-Lysine Methylation (GO:0018022)",0.982323631115001,0.987588957338407,0.0127239620971343,0.99203038145176
"Peptidyl-Lysine Modification (GO:0018205)",0.998378690896852,0.998484957654382,0.000350259476470468,0.998996532216712
"Peptidyl-Methionine Modification (GO:0018206)",0.994772248079118,0.99453238897464,0.00253299570428405,0.99728867040588
"Peptidyl-Proline Modification (GO:0018208)",0.998809544889532,0.998904027441693,0.00054077898725212,0.999418971956015
"Peptidyl-Threonine Dephosphorylation (GO:0035970)",0.998320745662697,0.99857445724678,0.000820513165030605,0.999088254842673
"Peptidyl-Threonine Modification (GO:0018210)",0.994498654900472,0.994440500494168,0.00111653942813097,0.996940203048684
"Peptidyl-Threonine Phosphorylation (GO:0018107)",0.994993523875365,0.994855419513982,0.000958247412858392,0.997173596097937
"Peptidyl-Tyrosine Dephosphorylation (GO:0035335)",0.998073775473883,0.998320037768251,0.000854230957041825,0.998961711616239
"Peptidyl-Tyrosine Modification (GO:0018212)",0.996288125871767,0.996068706794777,0.000991868299759006,0.998108999981803
"Peptidyl-Tyrosine Phosphorylation (GO:0018108)",0.997310473929334,0.997311502808305,0.000711440016414846,0.998467513532972
"Peripheral Nervous System Development (GO:0007422)",0.990132507425296,0.991568562914285,0.0065801828063263,0.995180072317846
"Peroxisomal Membrane Transport (GO:0015919)",0.992878083496938,0.993411863087857,0.00394938153956051,0.995622868881636
"Peroxisome Organization (GO:0007031)",0.983540299769886,0.984945806079435,0.0105779673873652,0.992482772969748
"Phagocytosis (GO:0006909)",0.999599179430753,0.999621146063702,0.000108655591560801,0.999748893819687
"Phagocytosis, Engulfment (GO:0006911)",0.999472853082811,0.999519806136408,0.000230623090102613,0.999696322147588
"Phagolysosome Assembly (GO:0001845)",0.998086806067048,0.998399364966198,0.000932733653990284,0.999052740929073
"Phagosome Maturation (GO:0090382)",0.998201692908926,0.99823650347553,0.000793339524076502,0.999180693281576
"Phosphatidic Acid Biosynthetic Process (GO:0006654)",0.986084572655792,0.987601958939822,0.00604479783971391,0.992662966498254
"Phosphatidic Acid Metabolic Process (GO:0046473)",0.986314089545682,0.987842696570669,0.00590301434760834,0.99264184267658
"Phosphatidylcholine Acyl-Chain Remodeling (GO:0036151)",0.999353403909978,0.999512905908131,0.000445338920186948,0.99962102045584
"Phosphatidylcholine Biosynthetic Process (GO:0006656)",0.995536011532086,0.996201718015029,0.00303789451937872,0.997633449434786
"Phosphatidylcholine Metabolic Process (GO:0046470)",0.999243513334266,0.999281206666127,0.000233165867003297,0.999508605282119
"Phosphatidylethanolamine Metabolic Process (GO:0046337)",0.986768171285535,0.987547937942823,0.00702833278254632,0.993734704717331
"Phosphatidylglycerol Metabolic Process (GO:0046471)",0.986480616621352,0.988685191628719,0.00806154881932529,0.994654914238855
"Phosphatidylinositol 3-Kinase Signaling (GO:0014065)",0.998677242244759,0.998697030438229,0.000455621432571515,0.999129918934335
"Phosphatidylinositol Biosynthetic Process (GO:0006661)",0.992887769244088,0.992935286901373,0.00117352798251903,0.99596201985401
"Phosphatidylinositol Dephosphorylation (GO:0046856)",0.953327876747979,0.950414764051461,0.018054232500291,0.983600521846827
"Phosphatidylinositol Metabolic Process (GO:0046488)",0.997382594088181,0.997496362158171,0.000508582311488726,0.998281315455536
"Phosphatidylinositol Phosphate Biosynthetic Process (GO:0046854)",0.991860058740943,0.993176078007743,0.0036644850062458,0.995417446324092
"Phosphatidylinositol-3-Phosphate Biosynthetic Process (GO:0036092)",0.983822728475844,0.986281139900806,0.0110621402015821,0.991787311958134
"Phosphatidylinositol-Mediated Signaling (GO:0048015)",0.998040575423399,0.99814646479683,0.000523983235315018,0.998711885411043
"Phosphatidylserine Metabolic Process (GO:0006658)",0.999012698644323,0.998981979215313,0.000510621044630295,0.99936353204197
"Phospholipase C-activating G Protein-Coupled Receptor Signaling Pathway (GO:0007200)",0.998976332368721,0.999004047439619,0.000484737162806192,0.999373317095157
"Phospholipid Biosynthetic Process (GO:0008654)",0.997014841000919,0.99730893846026,0.00118797963591178,0.998185502453501
"Phospholipid Catabolic Process (GO:0009395)",0.996653111254195,0.997491340032126,0.00228714953626683,0.998119622023137
"Phospholipid Dephosphorylation (GO:0046839)",0.952238863783082,0.945886653979868,0.0175700694430925,0.982619325687682
"Phospholipid Metabolic Process (GO:0006644)",0.999419420152956,0.999375585544167,0.00019687348086812,0.999579515544181
"Phospholipid Translocation (GO:0045332)",0.999031586580896,0.998990548277657,0.000400529969533906,0.999280675149465
"Phospholipid Transport (GO:0015914)",0.999245383902331,0.999342639108387,0.00040034110982675,0.999460361581954
"Photoperiodism (GO:0009648)",0.998334710223263,0.998703108132289,0.0013115489454938,0.99892216871791
"Pigment Granule Transport (GO:0051904)",0.996476967739377,0.997934455386237,0.00312521513212461,0.998448284290004
"Placenta Development (GO:0001890)",0.998590620180703,0.998543745239656,0.000671314717239838,0.999125260150791
"Plasma Membrane Bounded Cell Projection Morphogenesis (GO:0120039)",0.998896012369495,0.998913743426077,0.000331163797743793,0.999360729176276
"Plasma Membrane Bounded Cell Projection Organization (GO:0120036)",0.998597568261203,0.99863103757488,0.00032166696577736,0.99915721705749
"Plasma Membrane Invagination (GO:0099024)",0.998821805303726,0.998854274310178,0.000446902280416831,0.999305018725114
"Plasma Membrane Organization (GO:0007009)",0.998672939745389,0.998721483422555,0.000327907723758432,0.999323133630242
"Plasma Membrane Repair (GO:0001778)",0.997092102464641,0.997201789992225,0.000579571201184321,0.999035963757057
"Plasma Membrane Tubulation (GO:0097320)",0.997755517277054,0.997749677043409,0.00167818437256123,0.998684547610041
"Platelet Aggregation (GO:0070527)",0.998371601883746,0.998593059488186,0.00111770746555645,0.999231224112438
"Platelet Dense Granule Organization (GO:0060155)",0.998799816763307,0.999044582525144,0.000619786111181473,0.999348300118603
"Platelet-Derived Growth Factor Receptor Signaling Pathway (GO:0048008)",0.995159995092064,0.996485560387514,0.0035633452194139,0.996810335264986
"Polarized Epithelial Cell Differentiation (GO:0030859)",0.999503400003114,0.999531761017532,0.000121459930644606,0.999771575553588
"poly(A)+ mRNA Export From Nucleus (GO:0016973)",0.996776502575485,0.997766720605853,0.00207380829576598,0.998269732515289
"Polyamine Metabolic Process (GO:0006595)",0.999657406242073,0.999698194144305,0.000216932222187751,0.99979004357944
"Polyol Biosynthetic Process (GO:0046173)",0.998032126600356,0.998797687592068,0.00141218494584255,0.998620452732814
"Polyol Metabolic Process (GO:0019751)",0.980940551720396,0.981491016715849,0.00763451984340693,0.990849045570032
"Pore Complex Assembly (GO:0046931)",0.998333344736943,0.998513319379199,0.000850710542350688,0.999006837845373
"Porphyrin-Containing Compound Biosynthetic Process (GO:0006779)",0.999252107744886,0.999252303991279,0.000334940259523843,0.999467466085977
"Positive Chemotaxis (GO:0050918)",0.999757928869301,0.999781439001161,0.000119168317291025,0.999830835597383
"Positive Regulation By Host Of Viral Process (GO:0044794)",0.999779438594844,0.999818680065646,0.000130948019666492,0.999852342260362
"Positive Regulation By Host Of Viral Transcription (GO:0043923)",0.997093189443712,0.997083105357972,0.00100369378624156,0.998633113746632
"Positive Regulation By Symbiont Of Entry Into Host (GO:0075294)",0.999814051568566,0.999823864098005,0.0001068574470659,0.999917874140866
"Positive Regulation Of ATP-dependent Activity (GO:0032781)",0.999701597696659,0.999739060729869,0.000110709958280497,0.999816888582432
"Positive Regulation Of B Cell Activation (GO:0050871)",0.999304876782493,0.999359231567592,0.000219402145122207,0.999559005823778
"Positive Regulation Of B Cell Proliferation (GO:0030890)",0.999530886127737,0.999560418992913,0.000155758801331482,0.999678333403949
"Positive Regulation Of BMP Signaling Pathway (GO:0030513)",0.998498062345509,0.9986804547912,0.00104236862442507,0.999244505215725
"Positive Regulation Of CD4-positive, Alpha-Beta T Cell Activation (GO:2000516)",0.999901193198697,0.999926885755299,7.41799880483586e-05,0.999932632641863
"Positive Regulation Of CREB Transcription Factor Activity (GO:0032793)",0.9898940536909,0.99210446713982,0.00539647616002449,0.994329781371877
"Positive Regulation Of DNA Binding (GO:0043388)",0.999570752544529,0.999588015637574,0.000106910688223331,0.999759630125981
"Positive Regulation Of DNA Biosynthetic Process (GO:2000573)",0.998936841200885,0.999022764198753,0.000276570486143946,0.999383120921721
"Positive Regulation Of DNA Damage Response, Signal Transduction By P53 Class Mediator (GO:0043517)",0.999800409663539,0.99982117974573,8.81665425052423e-05,0.999875008676518
"Positive Regulation Of DNA Metabolic Process (GO:0051054)",0.998961908307332,0.998976790702672,0.000279160862614033,0.999313838320148
"Positive Regulation Of DNA Recombination (GO:0045911)",0.997337916017071,0.99727298847371,0.000596996416979121,0.998511308860487
"Positive Regulation Of DNA Repair (GO:0045739)",0.999507578295797,0.999516874909517,7.74831784771206e-05,0.999649261851621
"Positive Regulation Of DNA Replication (GO:0045740)",0.998814933588716,0.998870067969363,0.000349079644463458,0.99929455500279
"Positive Regulation Of DNA-directed DNA Polymerase Activity (GO:1900264)",0.993432091892962,0.994947766809628,0.00476196463579774,0.995963453696321
"Positive Regulation Of DNA-templated Transcription Initiation (GO:2000144)",0.996779049118919,0.997014250969574,0.000792973999783194,0.998406842628965
"Positive Regulation Of DNA-templated Transcription, Elongation (GO:0032786)",0.996376766532617,0.996416489168036,0.000756141043977176,0.998193238951677
"Positive Regulation Of ERAD Pathway (GO:1904294)",0.998409313704088,0.99849423288177,0.000453255565906641,0.999321514139027
"Positive Regulation Of ERBB Signaling Pathway (GO:1901186)",0.999330341660725,0.999323165185903,0.000177116145153539,0.999649686041698
"Positive Regulation Of G1/S Transition Of Mitotic Cell Cycle (GO:1900087)",0.999637684326047,0.999654735328899,0.00017899722053586,0.999765069266484
"Positive Regulation Of G2/M Transition Of Mitotic Cell Cycle (GO:0010971)",0.99545486042807,0.995889613415785,0.0021308914144284,0.997344752422855
"Positive Regulation Of JNK Cascade (GO:0046330)",0.999000800471623,0.999117787159156,0.000329681970996264,0.999331545739629
"Positive Regulation Of JUN Kinase Activity (GO:0043507)",0.999611474623626,0.999623277592371,0.000129413271296711,0.999714636326031
"Positive Regulation Of MAP Kinase Activity (GO:0043406)",0.999271043089859,0.99932779863461,0.000338748932063841,0.999501255678909
"Positive Regulation Of NIK/NF-kappaB Signaling (GO:1901224)",0.999459939695402,0.999508658439316,0.000221413836130104,0.999682729111449
"Positive Regulation Of NLRP3 Inflammasome Complex Assembly (GO:1900227)",0.997074748163977,0.997012677550995,0.00112715037554255,0.99859616922541
"Positive Regulation Of Notch Signaling Pathway (GO:0045747)",0.996192535790851,0.996277263350659,0.00164833286396281,0.998028973748847
"Positive Regulation Of RNA Metabolic Process (GO:0051254)",0.998379200092458,0.998613643319219,0.000954859557190813,0.998957171998244
"Positive Regulation Of RNA Splicing (GO:0033120)",0.996387557089283,0.99669664748305,0.000859947985983835,0.998644316536782
"Positive Regulation Of Ras Protein Signal Transduction (GO:0046579)",0.999264498657642,0.999267062038897,0.000251071145594498,0.999480791260453
"Positive Regulation Of Rho Protein Signal Transduction (GO:0035025)",0.999484353544742,0.999422281495998,0.0002734634933089,0.999646585303294
"Positive Regulation Of SMAD Protein Signal Transduction (GO:0060391)",0.991437768902114,0.992907328917693,0.00597888357993629,0.995857893660606
"Positive Regulation Of T Cell Activation (GO:0050870)",0.999660532177899,0.999701600816344,0.00012382072778583,0.999778141186058
"Positive Regulation Of T Cell Chemotaxis (GO:0010820)",0.989096036925885,0.993508152152808,0.0104723153613481,0.994538183948144
"Positive Regulation Of T Cell Cytokine Production (GO:0002726)",0.999473759614881,0.999509945345758,0.000322678064204898,0.999646912359654
"Positive Regulation Of T Cell Differentiation (GO:0045582)",0.99944572381067,0.999412162785976,0.000117864336990475,0.999625897954226
"Positive Regulation Of T Cell Mediated Cytotoxicity (GO:0001916)",0.999934810250576,0.999943894822214,2.85177769586512e-05,0.999962686210991
"Positive Regulation Of T Cell Mediated Immunity (GO:0002711)",0.999874553978955,0.999908856748821,7.17411331629528e-05,0.999924954222208
"Positive Regulation Of T Cell Migration (GO:2000406)",0.994684678433156,0.996536846319183,0.0054269820769248,0.996982606855453
"Positive Regulation Of T Cell Proliferation (GO:0042102)",0.999366801500676,0.999457003081875,0.000282685660930192,0.999601376369626
"Positive Regulation Of T Cell Receptor Signaling Pathway (GO:0050862)",0.99968234155301,0.999762154823456,0.000158308167655308,0.999768811473965
"Positive Regulation Of T-helper 17 Type Immune Response (GO:2000318)",0.981399037997026,0.981050041087106,0.00829511852550702,0.994446476907555
"Positive Regulation Of T-helper Cell Differentiation (GO:0045624)",0.997478200548923,0.997673829439258,0.00118256012375057,0.998555884083706
"Positive Regulation Of TOR Signaling (GO:0032008)",0.997945565239251,0.99808451369883,0.00052370212172365,0.998850991863068
"Positive Regulation Of TORC1 Signaling (GO:1904263)",0.997226456096497,0.997354353645588,0.000674121431735739,0.998478156003106
"Positive Regulation Of Wnt Signaling Pathway (GO:0030177)",0.997442470529202,0.997536234203748,0.000609669071194745,0.998662228979119
"Positive Regulation Of Actin Filament Bundle Assembly (GO:0032233)",0.999768933933914,0.999735352361033,8.46087281539342e-05,0.999861588890575
"Positive Regulation Of Actin Filament Polymerization (GO:0030838)",0.999485238662238,0.999500266342459,0.000226921378490788,0.999683359155485
"Positive Regulation Of Activated T Cell Proliferation (GO:0042104)",0.999708044214184,0.999710843594071,0.000106491979518291,0.999805530004344
"Positive Regulation Of Adaptive Immune Response Based On Somatic Recombination Of Immune Receptors Built From Immunoglobulin Superfamily Domains (GO:0002824)",0.999614919902362,0.999629978861138,0.00021591956220638,0.999726116469836
"Positive Regulation Of Adenylate Cyclase Activity (GO:0045762)",0.992524816407038,0.992868092142994,0.00420317753478925,0.99620559638282
"Positive Regulation Of Alpha-Beta T Cell Activation (GO:0046635)",0.99985505177166,0.999870774157323,7.84389422955906e-05,0.999929032445305
"Positive Regulation Of Alpha-Beta T Cell Differentiation (GO:0046638)",0.99838041627685,0.998515045208047,0.000753238361605703,0.999202201444113
"Positive Regulation Of Alpha-Beta T Cell Proliferation (GO:0046641)",0.999706737025533,0.999701201506527,0.000107817928929874,0.999817933780154
"Positive Regulation Of Amide Metabolic Process (GO:0034250)",0.999580146378939,0.999578102930275,6.30166430309697e-05,0.999736406450817
"Positive Regulation Of Amyloid Precursor Protein Catabolic Process (GO:1902993)",0.997704424621897,0.998017039922076,0.00102900363940365,0.998715612813594
"Positive Regulation Of Amyloid-Beta Formation (GO:1902004)",0.998255219745928,0.9983762206494,0.000573325452632611,0.999001592856492
"Positive Regulation Of Angiogenesis (GO:0045766)",0.999362127490093,0.999386561781779,0.000167815054055566,0.999618824160376
"Positive Regulation Of Antigen Receptor-Mediated Signaling Pathway (GO:0050857)",0.999557823951741,0.999564937852396,0.000172444182420406,0.999705497989804
"Positive Regulation Of Apoptotic Signaling Pathway (GO:2001235)",0.999521049830893,0.999558848290991,0.000142814185614873,0.999704697894176
"Positive Regulation Of Attachment Of Spindle Microtubules To Kinetochore (GO:0051987)",0.998902080297278,0.999100525668861,0.000934472459732055,0.999332853480788
"Positive Regulation Of Autophagosome Assembly (GO:2000786)",0.996286284374134,0.996578727816631,0.0014980628231495,0.997942352338072
"Positive Regulation Of Autophagy (GO:0010508)",0.998414348047287,0.998482382739957,0.000471147962289943,0.999042300179471
"Positive Regulation Of Axon Extension (GO:0045773)",0.99746391437065,0.997674617717134,0.00153623703558191,0.998424552037002
"Positive Regulation Of Axonogenesis (GO:0050772)",0.996599823389203,0.997069392112426,0.00125831575806874,0.997793076208988
"Positive Regulation Of Binding (GO:0051099)",0.999636049167065,0.999649317779013,0.000107489108871298,0.999760099626661
"Positive Regulation Of Biomineral Tissue Development (GO:0070169)",0.998689000441395,0.998618337688196,0.000532146830618908,0.999190050207838
"Positive Regulation Of Biosynthetic Process (GO:0009891)",0.999380467656607,0.999524673443724,0.000448371222299684,0.999589784092675
"Positive Regulation Of Blood Coagulation (GO:0030194)",0.999305248298908,0.999251713070238,0.000370998675826107,0.999554071258474
"Positive Regulation Of Blood Vessel Endothelial Cell Migration (GO:0043536)",0.999820010061087,0.999838743827336,7.65360887472982e-05,0.999886301360755
"Positive Regulation Of Bone Mineralization (GO:0030501)",0.998103649978436,0.998176514580999,0.000757180031669379,0.998824682403109
"Positive Regulation Of calcineurin-NFAT Signaling Cascade (GO:0070886)",0.999127014415009,0.999072106185694,0.000322499133104909,0.999413451912703
"Positive Regulation Of Calcineurin-Mediated Signaling (GO:0106058)",0.999127014415009,0.999072106185694,0.000322499133104909,0.999413451912703
"Positive Regulation Of Calcium Ion Transmembrane Transport (GO:1904427)",0.981457326927577,0.996035619650913,0.0266276015150036,0.989018452427688
"Positive Regulation Of Calcium Ion Transmembrane Transporter Activity (GO:1901021)",0.999658378873778,0.999662253110767,0.000129344757659874,0.999804347761492
"Positive Regulation Of Calcium Ion Transport (GO:0051928)",0.999340019421655,0.999358682998104,0.000384900474054255,0.999631603354802
"Positive Regulation Of Canonical Wnt Signaling Pathway (GO:0090263)",0.997470781846978,0.997536455622237,0.000656826497491013,0.998674225215487
"Positive Regulation Of Carbohydrate Metabolic Process (GO:0045913)",0.995219885984902,0.995031750443664,0.00125375770547679,0.997251923566781
"Positive Regulation Of Cardiac Muscle Hypertrophy (GO:0010613)",0.995510297688474,0.996931807857408,0.00365891251744478,0.997476657964919
"Positive Regulation Of Catabolic Process (GO:0009896)",0.999510659933814,0.999525445180492,0.000136137953187001,0.999703678782285
"Positive Regulation Of Catalytic Activity (GO:0043085)",0.999014575541501,0.999125836550959,0.000377886042355034,0.999475592706582
"Positive Regulation Of Cation Channel Activity (GO:2001259)",0.999905365193611,0.999898279507398,2.30870073477738e-05,0.999940185505842
"Positive Regulation Of Cell Activation (GO:0050867)",0.99916164782482,0.999465643054571,0.000795884071692432,0.999531880641797
"Positive Regulation Of Cell Adhesion (GO:0045785)",0.998799741189336,0.998977018208199,0.000615850328236291,0.999238036982934
"Positive Regulation Of Cell Adhesion Mediated By Integrin (GO:0033630)",0.997576856594722,0.998900787809021,0.00329999106027519,0.998467112188623
"Positive Regulation Of Cell Communication (GO:0010647)",0.994786357965506,0.995740838298785,0.00471630243617111,0.996665365509578
"Positive Regulation Of Cell Cycle (GO:0045787)",0.999193584853908,0.999194509596373,0.000223704634733211,0.999472144001705
"Positive Regulation Of Cell Cycle G1/S Phase Transition (GO:1902808)",0.999548347000536,0.999575783711705,0.000182078691126638,0.99970784013711
"Positive Regulation Of Cell Cycle G2/M Phase Transition (GO:1902751)",0.99789404837241,0.998248269215418,0.000713590932697553,0.998721718218168
"Positive Regulation Of Cell Cycle Phase Transition (GO:1901989)",0.998740606125143,0.998923336382002,0.000612406779032582,0.999194081883397
"Positive Regulation Of Cell Cycle Process (GO:0090068)",0.999130220452691,0.99914328337187,0.000168905587074548,0.999395976971341
"Positive Regulation Of Cell Death (GO:0010942)",0.998026879543076,0.998132977346958,0.0014406839675003,0.99863465887708
"Positive Regulation Of Cell Development (GO:0010720)",0.9977326954518,0.998015338765881,0.00112503749685058,0.998702516621061
"Positive Regulation Of Cell Division (GO:0051781)",0.999707901931424,0.999727871718358,0.000137181066263978,0.999784200539015
"Positive Regulation Of Cell Growth (GO:0030307)",0.999562798139541,0.999577106606117,0.000123606395983313,0.999711973768641
