"Pathway","R2mean","R2median","R2sd","V1VE"
"Regulation Of Cell Fate Specification (GO:0042659)",0.989331064202618,0.991249754489986,0.00676734643381433,0.99664162205159
"Regulation Of Cell Junction Assembly (GO:1901888)",0.998537440120174,0.998783859948546,0.000771402182143613,0.999226662180947
"Regulation Of Cell Migration Involved In Sprouting Angiogenesis (GO:0090049)",0.999799562643836,0.999815057682504,8.9946499683909e-05,0.999890649840617
"Regulation Of Cell Morphogenesis (GO:0022604)",0.999742592010726,0.999796126447575,0.000166181491401712,0.999813959241125
"Regulation Of Cell Motility (GO:2000145)",0.999720866433136,0.999748845937076,7.83445769623726e-05,0.999808587650195
"Regulation Of Cell Size (GO:0008361)",0.99955800825227,0.999592828302551,0.000212536389540803,0.999757996625321
"Regulation Of Cell-Cell Adhesion (GO:0022407)",0.998674913694502,0.998799894452436,0.000626622783474672,0.999153543717045
"Regulation Of Cell-Cell Adhesion Mediated By Cadherin (GO:2000047)",0.999199829484169,0.999569984132393,0.000613376432919714,0.999570197109361
"Regulation Of Cell-Matrix Adhesion (GO:0001952)",0.999338068500101,0.999372044567399,0.00022217654884235,0.999571484298371
"Regulation Of Cell-Substrate Adhesion (GO:0010810)",0.999618827255767,0.999661068074467,0.000183772140509065,0.999756944079852
"Regulation Of Cell-Substrate Junction Assembly (GO:0090109)",0.999147612561931,0.999376711554051,0.00059693826444207,0.999463222971849
"Regulation Of Cellular Biosynthetic Process (GO:0031326)",0.999326916825117,0.999445548612439,0.000341574885174689,0.999543537753715
"Regulation Of Cellular Catabolic Process (GO:0031329)",0.998940610004177,0.9989699395853,0.00026627277924515,0.999329554872112
"Regulation Of Cellular Component Biogenesis (GO:0044087)",0.99899632301165,0.999116971578694,0.000463006642369178,0.9994211149961
"Regulation Of Cellular Component Size (GO:0032535)",0.999303525452084,0.999397994577681,0.000318930523358296,0.999646737885612
"Regulation Of Cellular Localization (GO:0060341)",0.99895290125364,0.998938098698851,0.000198765001231344,0.99939611926106
"Regulation Of Cellular Metabolic Process (GO:0031323)",0.99903244396745,0.999073524702907,0.000152129281490483,0.999473663332962
"Regulation Of Cellular Respiration (GO:0043457)",0.999070941008589,0.999057949777184,0.000441009566994311,0.999494979514337
"Regulation Of Cellular Response To Heat (GO:1900034)",0.99767380016803,0.997823271990649,0.000932579576831537,0.998970084970495
"Regulation Of Cellular Response To Stress (GO:0080135)",0.998231537770581,0.998253432801341,0.000458425554204607,0.998979066378849
"Regulation Of Cellular Response To Transforming Growth Factor Beta Stimulus (GO:1903844)",0.998359429339811,0.998200999355921,0.000820649037765109,0.998939965733112
"Regulation Of Cellular Senescence (GO:2000772)",0.999903780083743,0.999921383428509,3.89354723910124e-05,0.999926248716236
"Regulation Of Centriole Replication (GO:0046599)",0.998901703733181,0.999028391505554,0.000699489271120157,0.999254714179455
"Regulation Of Centrosome Cycle (GO:0046605)",0.998145696652406,0.997989191325217,0.00057403180972135,0.999241271293626
"Regulation Of Centrosome Duplication (GO:0010824)",0.998501488079199,0.99837423881144,0.000471174110589439,0.99925968192055
"Regulation Of Chemokine (C-X-C Motif) Ligand 2 Production (GO:2000341)",0.999154624042128,0.999366767387237,0.000807503749217253,0.999520617011697
"Regulation Of Chemokine Production (GO:0032642)",0.999340172612153,0.999365735014295,0.000239923321158912,0.999603469751711
"Regulation Of Chemotaxis (GO:0050920)",0.998941152013218,0.999097070587095,0.000402841282339717,0.999480283300474
"Regulation Of Cholesterol Biosynthetic Process (GO:0045540)",0.99607772682495,0.997050789639916,0.00379699799637753,0.997326714952661
"Regulation Of Cholesterol Efflux (GO:0010874)",0.999310378286175,0.999403030468643,0.000393695195105787,0.999503948652759
"Regulation Of Cholesterol Metabolic Process (GO:0090181)",0.991177028354047,0.993672121902417,0.00834627431101936,0.993999458232142
"Regulation Of Cholesterol Storage (GO:0010885)",0.998040925049949,0.998062575819745,0.000950823911128653,0.998914085194358
"Regulation Of Cholesterol Transport (GO:0032374)",0.999380148057397,0.999424419188434,0.000223014863369739,0.999615473702396
"Regulation Of Chromatin Organization (GO:1902275)",0.99711461861408,0.997270398117239,0.000998493422136344,0.998136254121211
"Regulation Of Chromosome Organization (GO:0033044)",0.993054113890045,0.993517543075622,0.00163619483724151,0.996543954510515
"Regulation Of Chromosome Segregation (GO:0051983)",0.990365571822563,0.993359070807326,0.0075630173166938,0.994326112006533
"Regulation Of Chromosome Separation (GO:1905818)",0.999257424362962,0.999380209957395,0.000541607635337422,0.999507175477877
"Regulation Of Cilium Assembly (GO:1902017)",0.99519879538468,0.995735229363551,0.001815975436999,0.997149682176785
"Regulation Of Clathrin-Dependent Endocytosis (GO:2000369)",0.987721513683461,0.98846724961709,0.00393700779296838,0.994799952265582
"Regulation Of Cold-Induced Thermogenesis (GO:0120161)",0.998140688840469,0.998118907820515,0.00054058688579293,0.998868056868819
"Regulation Of Collagen Biosynthetic Process (GO:0032965)",0.99982541517179,0.999850089182562,9.80888113992384e-05,0.999877005203196
"Regulation Of Cyclin-Dependent Protein Kinase Activity (GO:1904029)",0.998857260516046,0.998804762892404,0.000224962652749616,0.999269141812443
"Regulation Of Cyclin-Dependent Protein Serine/Threonine Kinase Activity (GO:0000079)",0.99847273705764,0.998601575292723,0.000423669118169257,0.998983242015827
"Regulation Of Cysteine-Type Endopeptidase Activity (GO:2000116)",0.99912611459644,0.999265617762196,0.000485117664507613,0.999578427330551
"Regulation Of Cysteine-Type Endopeptidase Activity Involved In Apoptotic Process (GO:0043281)",0.999174061843067,0.999219015678448,0.000210269297800938,0.999581763741947
"Regulation Of Cytokine Production Involved In Immune Response (GO:0002718)",0.999287969036044,0.999370185059882,0.000341344504277854,0.999557100054382
"Regulation Of Cytokine Production Involved In Inflammatory Response (GO:1900015)",0.997741818971751,0.997793511227562,0.000636914883188146,0.998757508273441
"Regulation Of Cytokine-Mediated Signaling Pathway (GO:0001959)",0.99902036224245,0.999013132794496,0.00024648897856433,0.99946367877444
"Regulation Of Cytokinesis (GO:0032465)",0.999184665108969,0.999261653768657,0.000306976199736755,0.999478407511015
"Regulation Of Cytoplasmic Translation (GO:2000765)",0.999674162694619,0.999692114759965,9.80242033635496e-05,0.999819318702069
"Regulation Of Cytoskeleton Organization (GO:0051493)",0.999553631355187,0.999558731045639,4.55631158122241e-05,0.99972047365298
"Regulation Of Cytosolic Calcium Ion Concentration (GO:0051480)",0.998678662896047,0.999275761703344,0.00127396699855237,0.999083207401611
"Regulation Of Defense Response (GO:0031347)",0.99959566421202,0.999580926756372,0.000122070411561448,0.999739556860084
"Regulation Of Defense Response To Virus (GO:0050688)",0.994638691074804,0.994671418513826,0.00258905855524172,0.997331677381332
"Regulation Of Defense Response To Virus By Host (GO:0050691)",0.998908155963235,0.999088004517136,0.000400872445920278,0.999286075259754
"Regulation Of Dendrite Development (GO:0050773)",0.996896976262543,0.997237569942817,0.00215510550975088,0.997837632020475
"Regulation Of Dendrite Morphogenesis (GO:0048814)",0.998069253825765,0.998503941238273,0.00161084284594006,0.998725247483466
"Regulation Of Dendritic Cell Differentiation (GO:2001198)",0.999846685799917,0.999846823830224,7.64359091158025e-05,0.999931931514954
"Regulation Of Dendritic Spine Development (GO:0060998)",0.998563077904811,0.998818581744889,0.00082411789338058,0.999137967063323
"Regulation Of Dendritic Spine Morphogenesis (GO:0061001)",0.999476594969538,0.99951917700157,0.000283128081688565,0.999636037872583
"Regulation Of Dephosphorylation (GO:0035303)",0.994310950699837,0.99435954557114,0.0023209784165083,0.997018859080409
"Regulation Of Developmental Growth (GO:0048638)",0.995497978221926,0.996844391344584,0.00395658675359426,0.997085624786876
"Regulation Of Dosage Compensation By Inactivation Of X Chromosome (GO:1900095)",0.977238676255224,0.979097286624322,0.0123424779012223,0.994056064819154
"Regulation Of Double-Strand Break Repair (GO:2000779)",0.997579193224823,0.997569740236467,0.00056478791502257,0.99860496585683
"Regulation Of Double-Strand Break Repair Via Homologous Recombination (GO:0010569)",0.999537167266857,0.999498441327256,0.0001198239231424,0.999677749171844
"Regulation Of Double-Strand Break Repair Via Nonhomologous End Joining (GO:2001032)",0.996481794459952,0.997310999028363,0.00245438107692547,0.998054176320647
"Regulation Of Early Endosome To Late Endosome Transport (GO:2000641)",0.998532691233263,0.998576650756992,0.000705954883390835,0.99930303634077
"Regulation Of Embryonic Development (GO:0045995)",0.998970265540362,0.998863392871802,0.000265204898656698,0.999272789658905
"Regulation Of Endocytosis (GO:0030100)",0.998983393083534,0.99904918489674,0.000421617768639146,0.999437266998004
"Regulation Of Endopeptidase Activity (GO:0052548)",0.999574018811325,0.999566932016966,0.000156479731933587,0.999772782146309
"Regulation Of Endoplasmic Reticulum Stress-Induced Intrinsic Apoptotic Signaling Pathway (GO:1902235)",0.999109376631887,0.999260038814172,0.000388339624145411,0.999561975890063
"Regulation Of Endothelial Cell Apoptotic Process (GO:2000351)",0.999599520904142,0.999566779516576,0.000114185628745299,0.999737308661199
"Regulation Of Endothelial Cell Migration (GO:0010594)",0.999323181249635,0.999371030451295,0.000288794228799608,0.999560300136073
"Regulation Of Endothelial Cell Proliferation (GO:0001936)",0.997628875754497,0.997717624811752,0.000963277278649218,0.998517212602283
"Regulation Of Epidermal Cell Differentiation (GO:0045604)",0.998996254595478,0.999110050357102,0.00049665183815198,0.999475833582446
"Regulation Of Epidermal Growth Factor Receptor Signaling Pathway (GO:0042058)",0.998933684400467,0.999007849184094,0.000243697103859095,0.999390837419252
"Regulation Of Epidermal Growth Factor-Activated Receptor Activity (GO:0007176)",0.997096787819089,0.997054380795001,0.00125533169456284,0.998529499455716
"Regulation Of Epithelial Cell Differentiation (GO:0030856)",0.999745603680042,0.999799409623946,0.000140064313233209,0.999814482708653
"Regulation Of Epithelial Cell Migration (GO:0010632)",0.999563147545741,0.999591970838359,0.000181686778764761,0.999709087192139
"Regulation Of Epithelial Cell Proliferation (GO:0050678)",0.999763731526801,0.999768964079054,7.93359682414704e-05,0.999837998707994
"Regulation Of Epithelial To Mesenchymal Transition (GO:0010717)",0.99932384015491,0.999329013428602,0.000163436201148142,0.999540487887357
"Regulation Of Erythrocyte Differentiation (GO:0045646)",0.998742591985538,0.998818906613265,0.000545063292554143,0.999300173806571
"Regulation Of Establishment Of Cell Polarity (GO:2000114)",0.996261589194653,0.996994895251771,0.00227393361119871,0.997909263649008
"Regulation Of Establishment Of Endothelial Barrier (GO:1903140)",0.999437705316205,0.99945733382739,0.0002366909896573,0.999647766448266
"Regulation Of Establishment Of Planar Polarity (GO:0090175)",0.999884203188423,0.999891011483427,6.31187716282519e-05,0.999918915024817
"Regulation Of Establishment Of Protein Localization (GO:0070201)",0.999669750617981,0.999772623385392,0.000267761882859221,0.999771468140617
"Regulation Of Establishment Of Protein Localization To Telomere (GO:0070203)",0.995924831603879,0.996468395748843,0.00179724144827325,0.999016972640903
"Regulation Of Establishment Or Maintenance Of Cell Polarity (GO:0032878)",0.997238889053876,0.998350785354947,0.00196683379825533,0.998304202838036
"Regulation Of Execution Phase Of Apoptosis (GO:1900117)",0.999864920097659,0.999903612417211,0.000116963624279996,0.999897089384889
"Regulation Of Exit From Mitosis (GO:0007096)",0.999499880923017,0.999550836979439,0.000319021021517496,0.999673385847227
"Regulation Of Exocytosis (GO:0017157)",0.999708228426592,0.999686678815253,7.41751700878578e-05,0.999818541646662
"Regulation Of Exosomal Secretion (GO:1903541)",0.999386632003273,0.999421122600361,0.000354100241037721,0.999683014547112
"Regulation Of Extracellular Matrix Disassembly (GO:0010715)",0.999776384129995,0.99978012700154,9.38643754391448e-05,0.999828180218525
"Regulation Of Extracellular Matrix Organization (GO:1903053)",0.990000537589102,0.990781333401016,0.00293301678253344,0.99508475330282
"Regulation Of Extrinsic Apoptotic Signaling Pathway (GO:2001236)",0.999104332418548,0.999146446144507,0.000220243741194121,0.99946336674949
"Regulation Of Extrinsic Apoptotic Signaling Pathway In Absence Of Ligand (GO:2001239)",0.998885421351351,0.999109953484016,0.00100170299777558,0.999294176022778
"Regulation Of Extrinsic Apoptotic Signaling Pathway Via Death Domain Receptors (GO:1902041)",0.999565157490688,0.9995682777832,0.000104213170488848,0.999766742138088
"Regulation Of Fat Cell Differentiation (GO:0045598)",0.999029314000229,0.999096787100378,0.000405014400249833,0.999390404900377
"Regulation Of Fatty Acid Beta-Oxidation (GO:0031998)",0.938665063458429,0.947724018232921,0.0352169299796489,0.980479978773905
"Regulation Of Fatty Acid Biosynthetic Process (GO:0042304)",0.998378148391862,0.998606147324385,0.00083327777609616,0.999022407356699
"Regulation Of Fatty Acid Oxidation (GO:0046320)",0.999011417603888,0.999165472454657,0.00060778457554241,0.999362084505068
"Regulation Of Fibrinolysis (GO:0051917)",0.99983093069662,0.999853600682874,0.000152486102157966,0.999887495474114
"Regulation Of Fibroblast Growth Factor Receptor Signaling Pathway (GO:0040036)",0.999816574201125,0.999834122790296,6.72433653562167e-05,0.999856625839659
"Regulation Of Fibroblast Migration (GO:0010762)",0.999612512462114,0.999603110591874,9.05167841789094e-05,0.999767380925511
"Regulation Of Fibroblast Proliferation (GO:0048145)",0.999861782035331,0.999886371147781,6.81654028654661e-05,0.999903790379914
"Regulation Of Filopodium Assembly (GO:0051489)",0.999145973241198,0.999193686171032,0.000326583087606457,0.999524454114709
"Regulation Of Focal Adhesion Assembly (GO:0051893)",0.999768655033745,0.99977076464262,8.49909786550565e-05,0.999857696443986
"Regulation Of Gluconeogenesis (GO:0006111)",0.992489322977605,0.992905136342102,0.00394026686469999,0.996451411367704
"Regulation Of Glucose Import (GO:0046324)",0.998958811774215,0.998998158531522,0.000270914482272745,0.99942253898702
"Regulation Of Glucose Metabolic Process (GO:0010906)",0.997608047476722,0.997495142659538,0.00109773261678481,0.998417960285289
"Regulation Of Glucose Transmembrane Transport (GO:0010827)",0.999720138188326,0.99983375669485,0.000233995675676808,0.9997890826561
"Regulation Of Glycogen Biosynthetic Process (GO:0005979)",0.971231125959311,0.97143136013901,0.00967320042861327,0.988455357314606
"Regulation Of Glycolytic Process (GO:0006110)",0.997296016977783,0.997580127370358,0.000949901626008567,0.998480315270579
"Regulation Of Granulocyte Chemotaxis (GO:0071622)",0.997651109987384,0.999184333049992,0.00353205621069017,0.998763847142805
"Regulation Of Heart Contraction (GO:0008016)",0.999085407487836,0.999101669156166,0.000409537568568389,0.999464406058359
"Regulation Of Heart Rate By Cardiac Conduction (GO:0086091)",0.998446249102865,0.99830092170648,0.000921237110501673,0.998927714573251
"Regulation Of Hematopoietic Progenitor Cell Differentiation (GO:1901532)",0.998957566112562,0.999089965728397,0.00071967650192349,0.999343006658194
"Regulation Of Hematopoietic Stem Cell Differentiation (GO:1902036)",0.997698661495483,0.99754616241595,0.000798143638036204,0.99882621531184
"Regulation Of Hemopoiesis (GO:1903706)",0.99946052795515,0.999535867613709,0.000249305822368725,0.999615824642787
"Regulation Of Heterotypic Cell-Cell Adhesion (GO:0034114)",0.999067373090228,0.999305154243336,0.000675481916242916,0.99944563332703
"Regulation Of Hippo Signaling (GO:0035330)",0.99305094621375,0.994269025763257,0.00465847893980713,0.996728480701269
"Regulation Of Histone H3-K4 Methylation (GO:0051569)",0.980447575798085,0.980403321081284,0.00716960056125495,0.993988263738897
"Regulation Of Histone Acetylation (GO:0035065)",0.994296722084851,0.994262338952523,0.00259716873582076,0.997669473921891
"Regulation Of Histone Deacetylation (GO:0031063)",0.993414583026349,0.994175728590355,0.0021208639596611,0.996790810124251
"Regulation Of Histone Modification (GO:0031056)",0.996337251193935,0.996670480767468,0.00181901257444595,0.99814447668558
"Regulation Of Homotypic Cell-Cell Adhesion (GO:0034110)",0.998981153873372,0.999263358081044,0.000914404376114261,0.999434369540156
"Regulation Of Hormone Secretion (GO:0046883)",0.995978380246128,0.996397032257837,0.003253458194227,0.998171690683048
"Regulation Of Humoral Immune Response (GO:0002920)",0.998193508441141,0.998486581941659,0.00140932947650993,0.999033269054403
"Regulation Of Hydrolase Activity (GO:0051336)",0.995925198472974,0.996437335180153,0.00173700779970136,0.997654249215882
"Regulation Of Immune Effector Process (GO:0002697)",0.999925553368286,0.999947190627363,5.333251024217e-05,0.999952189399905
"Regulation Of Immune Response (GO:0050776)",0.999431886603552,0.99945459837637,0.000169909847661879,0.99966513361623
"Regulation Of Immunoglobulin Production (GO:0002637)",0.999256145040579,0.999285239559558,0.000243598735065206,0.99956915664659
"Regulation Of Inflammatory Response To Antigenic Stimulus (GO:0002861)",0.999545345796516,0.999610008889917,0.000241003886573532,0.999717073190539
"Regulation Of Innate Immune Response (GO:0045088)",0.997807665546798,0.997795454955744,0.000627900391025512,0.998894789815406
"Regulation Of Insulin Receptor Signaling Pathway (GO:0046626)",0.99906777008205,0.999186195323937,0.000281392679860157,0.999375462852341
"Regulation Of Insulin Secretion (GO:0050796)",0.998206923274493,0.998709244004622,0.00136579798874538,0.998770280248384
"Regulation Of Insulin Secretion Involved In Cellular Response To Glucose Stimulus (GO:0061178)",0.999862589941567,0.999867366879311,6.04857079028108e-05,0.999899507672266
"Regulation Of Integrin Activation (GO:0033623)",0.999259963987102,0.999336933950343,0.000546707167795412,0.999519123091112
"Regulation Of Integrin-Mediated Signaling Pathway (GO:2001044)",0.999950697226532,0.999954904140351,2.35611768892828e-05,0.99997017133548
"Regulation Of Interferon-Alpha Production (GO:0032647)",0.994706640240026,0.995305802906604,0.00250291013882457,0.997996308616877
"Regulation Of Interferon-Beta Production (GO:0032648)",0.998137287157202,0.998015798009593,0.00051966043744636,0.999044722403179
"Regulation Of Interleukin-1 Beta Production (GO:0032651)",0.999074572214585,0.999103767479714,0.000331824155517521,0.999441310470152
"Regulation Of Interleukin-1 Production (GO:0032652)",0.998327905947738,0.998761435671264,0.0012018512908196,0.999164840725195
"Regulation Of Interleukin-10 Production (GO:0032653)",0.99934808809023,0.999503832954966,0.000243351275226384,0.99958949224999
"Regulation Of Interleukin-12 Production (GO:0032655)",0.999552837266155,0.999556678809095,7.89380085589181e-05,0.999711610912329
"Regulation Of Interleukin-13 Production (GO:0032656)",0.999670831781829,0.999747037072782,0.000161428642821227,0.999763683941318
"Regulation Of Interleukin-17 Production (GO:0032660)",0.996446262583001,0.996265778822471,0.00118607435988937,0.998014926054691
"Regulation Of Interleukin-2 Production (GO:0032663)",0.99950543737206,0.999540001368346,0.000193559794659656,0.99970079563747
"Regulation Of Interleukin-4 Production (GO:0032673)",0.999855262649635,0.999846761538429,5.28910418733626e-05,0.999913612340891
"Regulation Of Interleukin-6 Production (GO:0032675)",0.999492212284658,0.99953169744598,0.000170879650397261,0.999689143222888
"Regulation Of Interleukin-8 Production (GO:0032677)",0.999645846080678,0.99967689783684,0.000154091173018298,0.999784146089552
"Regulation Of Intracellular Estrogen Receptor Signaling Pathway (GO:0033146)",0.995102477475219,0.995464085764216,0.00218676358103795,0.997644447452557
"Regulation Of Intracellular Protein Transport (GO:0033157)",0.999244021422332,0.999306695521568,0.000519384000752436,0.999520747006538
"Regulation Of Intracellular Steroid Hormone Receptor Signaling Pathway (GO:0033143)",0.999234995706694,0.99928408460863,0.000316189792145853,0.999557653769304
"Regulation Of Intracellular Transport (GO:0032386)",0.99748715351507,0.997643916451003,0.000629327054441209,0.998736584317742
"Regulation Of Intrinsic Apoptotic Signaling Pathway (GO:2001242)",0.999505007894694,0.999521289226423,0.000173135775228206,0.999711523738718
"Regulation Of Intrinsic Apoptotic Signaling Pathway In Response To DNA Damage (GO:1902229)",0.999955511488049,0.999978316192655,4.5895071646817e-05,0.999963257852452
"Regulation Of Intrinsic Apoptotic Signaling Pathway In Response To DNA Damage By P53 Class Mediator (GO:1902165)",0.999875475314029,0.999868034549069,4.31257112954317e-05,0.999925148391193
"Regulation Of Keratinocyte Differentiation (GO:0045616)",0.998618707738464,0.998729901491012,0.000626417010127716,0.999108498908448
"Regulation Of Keratinocyte Proliferation (GO:0010837)",0.999057640624711,0.999236118624423,0.000413804548748024,0.999399950920192
"Regulation Of Kinase Activity (GO:0043549)",0.999676493199978,0.999677981171728,8.63100185463598e-05,0.999764859372023
"Regulation Of Lamellipodium Assembly (GO:0010591)",0.999658742689308,0.999678464149796,8.28606279861944e-05,0.999830044533491
"Regulation Of Lamellipodium Organization (GO:1902743)",0.999733763332584,0.999838945180847,0.000277799194936086,0.999872791453808
"Regulation Of Leukocyte Adhesion To Vascular Endothelial Cell (GO:1904994)",0.999528755462544,0.999573019382824,0.000268421213680397,0.99969668447692
"Regulation Of Leukocyte Chemotaxis (GO:0002688)",0.996511855836433,0.996672927445489,0.00210203352308464,0.997883218021075
"Regulation Of Leukocyte Migration (GO:0002685)",0.999713727560834,0.999750310010922,0.000162996854813062,0.999814678886389
"Regulation Of Lipid Biosynthetic Process (GO:0046890)",0.998223122210787,0.998624168437753,0.00146100110546447,0.99876515362463
"Regulation Of Lipid Catabolic Process (GO:0050994)",0.999598776405958,0.999558336131696,0.000148366187823672,0.999713718283558
"Regulation Of Lipid Metabolic Process (GO:0019216)",0.999613827914542,0.999678525666923,0.000159730611384906,0.999772277468337
"Regulation Of Lipid Storage (GO:0010883)",0.999649201494198,0.999693008264507,0.000163325876112016,0.999751670640139
"Regulation Of Lipopolysaccharide-Mediated Signaling Pathway (GO:0031664)",0.99919536417251,0.999312958893336,0.000332057040627241,0.999524216899171
"Regulation Of Long-Term Synaptic Potentiation (GO:1900271)",0.999557715467574,0.99964812477399,0.000287709305208561,0.999710716476274
"Regulation Of Lymphocyte Activation (GO:0051249)",0.996150180648348,0.996014220872886,0.00197595039687803,0.99760824580477
"Regulation Of Lymphocyte Differentiation (GO:0045619)",0.998488675185314,0.998672801568982,0.00071485020381318,0.999274569699267
"Regulation Of Lymphocyte Migration (GO:2000401)",0.999115920296212,0.999023275142822,0.000450574832132499,0.999380279908564
"Regulation Of Lymphocyte Proliferation (GO:0050670)",0.99987249545657,0.99990341728845,9.79897044765738e-05,0.999911105570649
"Regulation Of Lysosomal Lumen pH (GO:0035751)",0.999526860908737,0.999633120502093,0.000241251793303014,0.999758095093804
"Regulation Of mRNA 3'-End Processing (GO:0031440)",0.997746709289804,0.998553117930475,0.00163377797906029,0.998916865695508
"Regulation Of mRNA Catabolic Process (GO:0061013)",0.999108157309096,0.99909932802989,0.000207116637800254,0.999458711639409
"Regulation Of mRNA Metabolic Process (GO:1903311)",0.998306666070791,0.99881144204009,0.00123607276527564,0.999198168690795
"Regulation Of mRNA Processing (GO:0050684)",0.998038520625817,0.998118891632809,0.000448352793581548,0.99926188557459
"Regulation Of mRNA Splicing, Via Spliceosome (GO:0048024)",0.998359624865879,0.99840285098166,0.000260705164904594,0.999376615512179
"Regulation Of mRNA Stability (GO:0043488)",0.999332012548059,0.99933302507078,8.39257226214539e-05,0.999599865742645
"Regulation Of Macroautophagy (GO:0016241)",0.99934612766256,0.99935012275773,8.62605736731586e-05,0.999586429872256
"Regulation Of Macromolecule Biosynthetic Process (GO:0010556)",0.999561473134927,0.999586309689565,0.000154554177213748,0.999692529027945
"Regulation Of Macrophage Activation (GO:0043030)",0.999541010427371,0.999582680050161,0.000235201921764814,0.999712603408041
"Regulation Of Macrophage Chemotaxis (GO:0010758)",0.997639638140159,0.99896166793982,0.00299826982718705,0.998847972352339
"Regulation Of Macrophage Cytokine Production (GO:0010935)",0.999683680356524,0.999759142359093,0.000251809766134455,0.999795229077493
"Regulation Of Macrophage Derived Foam Cell Differentiation (GO:0010743)",0.999485087105933,0.99950123672958,0.000159030432454248,0.999644457106296
"Regulation Of Macrophage Differentiation (GO:0045649)",0.997494123166398,0.997294528612809,0.00143608393178217,0.99855703601204
"Regulation Of Mast Cell Degranulation (GO:0043304)",0.997891782133695,0.998050773948074,0.00114432379578856,0.99904409369965
"Regulation Of Megakaryocyte Differentiation (GO:0045652)",0.99849166930748,0.99881753296148,0.000794924808571466,0.999058435181921
"Regulation Of Meiotic Cell Cycle (GO:0051445)",0.999205590827087,0.999202684297732,0.00022563327459041,0.99950295285603
"Regulation Of Membrane Protein Ectodomain Proteolysis (GO:0051043)",0.999653747191812,0.999793738286059,0.000327884353571394,0.999775873790849
"Regulation Of Metal Ion Transport (GO:0010959)",0.999865209456984,0.999883540660798,7.99067821648488e-05,0.999903620329297
